title	text
clint eastwood warns political correctness killing country we’ve lost our sense of humor’	hollywood screen legend clint eastwood sounded off on what he described as the scourge of political correctness in an impassioned speech this weekend at the cannes film festival.
schwarzenegger you can have four hummers and still save the planet	arnold schwarzenegger has four hummers and likes nothing better than getting up at 5am to ride his harley davidson to the beach for breakfast yet the terminator star insists that should not stop him being an environmental evangelist.
adam sandler draws awards buzz in cannes with the meyerowitz stories’	critics sniffed when hollywood funnyman adam sandler got invited to cannes but his performance in the all-star the meyerowitz stories drew glowing reviews sunday and even buzz about a best actor prize.
snl dwayne johnson announces 2020 presidential run with running mate tom hanks	after a week of addressing speculation that he might challenge donald trump for the presidency in 2020 actor dwayne johnson went ahead and made it official in his monologue during the 42nd season finale of saturday night live.
watch alec baldwin as trump sings hallelujah in snl season finale cold open	in the saturday night live season 42 finale alec baldwin playing the role of president donald trump sang leonard cohen’s hallelujah, the same song snl had kate mckinnon cover in her hillary clinton role in the show after she lost the
susan sarandon i don’t think trump’s gonna make it through his whole term’	actress susan sarandon has boldly predicted that president donald trump may not make it through his first term in office.
anderson cooper sorry for crude donald trump remark to jeffrey lord	cnn anchor anderson cooper says he regrets making a crude and unprofessional remark about president donald trump to jeffrey lord live on-air friday during a segment on ac360.
watch tom cruise battles ultimate evil in final trailer for the mummy’	universal released the final trailer for its upcoming monster reboot the mummy this week.
watch battle of the sexes trailer explores 1973 king-riggs tennis match	emma stone and steve carrell play billie jean king and bobby riggs in fox searchlight’s upcoming drama battle of the sexes which examines the infamous 1973 tennis match between the two that became one of the most widely-viewed sporting events in america at the time.
jackie mason if russia investigators don’t need evidence neither does trump exclusive video)	in this week’s exclusive clip for breitbart news jackie explains that if democrats investigating president donald trump’s alleged connections to the russian government don’t need evidence to back up their claims the president should just follow their lead and start his own investigation.
mark cuban hints at 2020 presidential run against idiot trump	friday on abc’s the view, when asked if he wants to run for president in 2020 billionaire businessman and shark tank star mark cuban did not rule it out co-host joy behar asked so mark your name has actually been
netflix film okja plagued by technical difficulties at cannes film festival	netflix film okja was plagued by technical difficulties during its screening at the cannes film festival shortly after the festival announced a ban on all streaming films for next year’s entries deadline hollywood reports that netflix’s film okja was plagued with technical
aerosmith meets netanyahu during israel tour	aerosmith paid a visit to israeli prime minister bibi netanyahu in jerusalem the legendary band opened their farewell world tour in tel aviv on wednesday night to a sold-out crowd of 50,000 their first time playing in the city in 23 years.
‘mom stars launch campaign for planned parenthood	the stars of cbs’s mom are launching a donation campaign to support planned parenthood actresses allison janney and anna faris along with series co-creator/executive producer chuck lorre are kicking off their campaign to support the abortion industry giant in place of spending funds on an emmy fyc campaign reports deadline hollywood.
birthplace of grunge mourns seattle’s son chris cornell	grief-stricken chris cornell fans left flowers at memorials across seattle for the musician whose forceful somber songs helped cement the city’s place in rock history.
cher old out-of-touch democrats f*cked up the 2016 election	pop icon cher says that old out-of-touch democrats and their flawed messaging is the reason why donald trump won the election.
chris cornell’s wife says anxiety medication may have triggered suicide	the wife of chris cornell believes the late rock singer never would have intentionally taken his own life and that the side effects of medication he was taking may have played a role in his death.
report last man standing studio seeking new home for canceled sitcom	fans of cancelled abc sitcom last man standing have been provided a small glimmer of hope as studio 20th century fox television is reportedly looking to find a new home for the tim allen-starring series.
update medical examiner chris cornell committed suicide by hanging	soundgarden singer chris cornell committed suicide wednesday night in his detroit hotel room by hanging himself a medical examiner has confirmed.
‘daily show accused of transphobia over donna trump joke	comedy central’s daily show has been blasted on social media and accused of ridiculing transgender people after the show’s official twitter account cracked a joke about president donald trump transitioning into a woman.
cannes lionsgate acquires mel gibson-vince vaughn cop thriller dragged across concrete’	lionsgate has acquired the u.s distribution rights to dragged across concrete a police detective thriller starring vince vaughn and mel gibson.
dwayne the rock johnson being president is within my skill set’	actor and former professional wrestler dwayne johnson added more fuel to speculation surrounding his political future with an appearance on good morning america thursday during which he said he has the skill set required to run for president of the united states.
soundgarden frontman chris cornell dead at 52	rocker chris cornell who gained fame as the lead singer of the bands soundgarden and audioslave has died at age 52 and police said thursday that his death is being investigated as a possible suicide.
roger ailes has died	matt drudge of the drudge report has announced that roger ailes former ceo of fox news has died at 77 years old.
petition to save last man standing tops 275,000 signatures	more than a quarter-million people have put their names to a petition demanding abc bring back the highly-rated conservative sitcom last man standing.
70-year-old susan sarandon flaunts cleavage at cannes	actress susan sarandon turned heads on the red carpet at the cannes film festival wednesday as she posed in a revealing velvet dress during the festival’s opening night ceremony.
val kilmer credits christian science faith for helping to cure his cancer	val kilmer credits love and his christian science faith for helping him successfully beat cancer.
cbs under fire for lack of women leads in fall tv lineup	cbs is being once again called out for a lack of diversity in its programming after critics noted the network’s fall television lineup is composed nearly entirely of male characters in lead roles.
jimmy fallon betting big that late-night anti-trump hysteria will fade	jimmy fallon is adamant about not turning the tonight show into yet another all-trump-bashing-all-the-time late-night program.
amazon looks to take away the need to ever use a cable box again with integrated fire tv sets	amazon will start to ship television sets with fire tv built in as early as next month according to a report.
chelsea manning documentary xy chelsea being shopped at cannes	a documentary film about chelsea manning the transgender army private convicted and imprisoned for leaking classified national security documents is being shopped around at this week’s cannes film festival.
joss whedon film imagines world without beacon of hope planned parenthood	hollywood’s love affair with planned parenthood has taken a new turn with marvel director joss whedon making a short film imagining what the world could look like without the abortion giant.
michael moore nothing can stop trump except my new documentary	left-wing filmmaker michael moore has teamed with harvey and bob weinstein on a new documentary about donald trump a project which the director hopes will dissolve his presidency.”
‘arrested development to return for season 5 on netflix	popular sitcom arrested development will return for season 5 on netflix.
refugee superpower movie jupiter’s moon generates buzz in cannes	a fantasy feature film about a refugee who discovers he has superhero-like abilities is creating a ton of buzz at this year’s cannes film festival.
rupert murdoch calls special meeting as fox news ratings falter	fox news executive chairman rupert murdoch will host a company-wide meeting wednesday amid internal turmoil at the network and threats to its ratings dominance from msnbc.
5 unanswered questions about abc’s cancellation of last man standing’	abc entertainment president channing dungey held a press call tuesday morning to discuss the network’s fall 2017-18 lineup which for the first time in six years does not include its second-highest rated comedy while some reporters asked about last man’s cancellation the press call raised more questioned than it answered.
rosie o’donnell gives backing to democrat looking to unseat ted cruz	liberal actress and comedian rosie o’donnell announced tuesday that she had maxed out her donations to a prospective democratic challenger to sen ted cruz’s r-texas) telling her 1.05 million twitter followers ted cruz has 2 go.”
tim allen stunned and blindsided by last man standing cancellation	tim allen is speaking out about abc’s cancellation of his family sitcom last man standing.
miss usa walks back health care position after leftist outrage	newly-crowned miss usa kara mccullough is walking back an answer she gave during sunday night’s competition during which she called health care a privilege.”
100k sign petition to abc to save conservative values sitcom last man standing’	a fan’s petition to abc television to revive the now-canceled blue-collar sitcom last man standing has received more than 100,000 signatures in less than a week.
experts see possible north korea links to global cyberattack	seoul south korea ap cybersecurity experts are pointing to circumstantial evidence that north korea may be behind the global ransomware attack the way the hackers took hostage computers and servers across the world was similar to previous cyberattacks attributed to north korea.
disney refuses ransom to hackers who stole pirates of the caribbean’	disney is refusing thus far to buckle to hackers ransomware demands to return the new edition of pirates of the caribbean dead men tell no tales.
celebrity chef sandra lee i can’t stomach paul ryan	celebrity chef sandra lee says speaker of the house paul ryan makes her sick to her stomach.
conan o’brien to stand trial for alleged joke theft	if the best jokes are stolen the best comedians don’t think it’s funny when they’re accused of ripping off material.
flynn anonymous hetero assault allegations against queer pwr bttm singer spurs label to pull band’s discography	they paid for pwr bttm they say they got frt hs dt rpst instead.
aerosmith to launch farewell tour in tel aviv on wednesday	aerosmith frontman steven tyler and girlfriend aimee ann preston arrived in israel on saturday ahead of a concert scheduled to rock tel aviv on wednesday in hayarkon park.
hackers demand ransom payment from disney over stolen copy of pirates of the caribbean 5’	hackers have stolen disney’s upcoming film pirates of the caribbean dead men tell no tales and have threatened to release it online unless the studio pays the thieves a hefty ransom according to reports.
james woods rips planned parenthood ceo in mother’s day tweet	actor james woods had a message for planned parenthood president and ceo cecile richards after she tweeted a mother’s day message of her own.
history made american gods features tv’s most explicit gay sex scene between muslims	sunday night’s episode of starz’s fantasy drama american gods featured two muslim men engaged in what many television critics and observers have called the most explicit gay sex scene in tv history.
peta asks rihanna to donate fur coats to benefit syrian refugees	people for the ethical treatment of animals peta has requested that grammy award-winning singer rihanna donate her fur coats to benefit syrian refugees.
‘daily show’s jordan klepper to solve gun control debate with comedy special	comedy central’s jordan klepper will attempt to solve the contentious gun control debate with the premiere of a one-hour comedy special in june.
review get me roger stone shows just how deeply stone is embedded in the leftist psyche	get me roger stone the newly released netflix documentary that explores stone’s colorful career in politics is worth your time to watch even if you hate roger stone especially if you hate roger stone because you might learn how he gets under his hater’s skin so effectively.
‘snl showrunner rosie o’donnell too hateful to play steve bannon	lorne michaels the creative mind behind saturday night live said that the long-running variety show never reached out to rosie o’donnell to take on the role of white house chief strategist steve bannon because she would have approached the role from hate rather than from comedy.
actress talulah riley blasts emma watson’s confusing feminist equality campaign	actress talulah riley has criticized feminist activist emma watson for leading a confusing campaign on gender equality that seeks to eliminate differences between the sexes.
marvel comics cancels black lives matter-themed black panther due to poor sales	marvel comics has canceled its black lives matter-inspired comic book black panther the crew due to poor sales according to reports.
flynn critics call nuclear scientist miss usa dumb after she disses feminism and calls health care a privilege’	kara mccullough made the miss usa pageant great again—just not in the way the contest’s organizers intended.
left attacks black miss usa for saying health care not a right’	newly-crowned miss usa kara mccullough faced widespread backlash from liberal social media users after she called health care a”privilege and not a right while answering questions onstage during sunday night’s pageant.
former paramount pictures ceo brad grey dies at 59	former paramount pictures chairman and ceo brad grey died sunday at his california home after a battle with cancer his family has confirmed he was 59.
mother’s day director joss whedon grateful for his mom being dead	director joss whedon shared a heartwarming message on his twitter account sunday in honor of mother’s day the day when sons and daughters across the united states celebrate remember and express gratitude for the sacrifices that all mothers make to care for their children on a daily basis.
abc faces boycotts backlash after last man standing cancelled	the show was one of the few if not the only sitcoms on broadcast television to appeal to conservative family-oriented audiences.
emmy-winning actor powers boothe dies at 68	powers boothe a renowned character actor who won an emmy award for his portrayal of cult leader jim jones died sunday at his home in los angeles he was 68.
cnn’s cuomo to snl you guys were mean about huckabee sanders’	monday on cnn’s new day, co-host chris cuomo and alisyn camerota reacted to this week’s saturday night live skit featuring melissa mccarthy playing white house press secretary sean spicer cuomo said he did not care for the show depiction of
exclusive jackie mason only difference between mahmoud abbas and hamas is that abbas takes a shower	during a radio interview on sunday legendary comedian and staunch israel supporter jackie mason took strong issue with the repeated characterization of palestinian authority president mahmoud abbas as israel’s partner for peace.
nbc reviving must-see tv thursdays with will grace’	nbc is reviving its must-see tv thursday franchise this fall with the revival of will grace, and by moving its heartwarming hit this is us to the same night.
todd rundgren if you’re a trump supporter don’t come to my show’	todd rundgren isn’t bothered that some of his fans might avoid his concerts due to his politics.
steven tyler lands in israel ahead of aerosmith tel aviv concert	steven tyler lead singer of aerosmith landed in israel on saturday together with his partner aimee ann preston ahead of his concert on wednesday.
watch snl’s spicer reacts to possibility of being fired	this week’s saturday night live host melissa mccarthy reprised her role as white house press secretary sean spicer in a skit where spicer learned he was possibly being fired and replaced by sarah huckabee sanders mccarthy’s spicer stormed out of the
watch snl’s trump admits to firing comey over russian collusion investigation	during this week’s saturday night live, alec baldwin as president donald trump spoke with nbc’s lester holt played by michael che in an interview in the skit baldwin admitted to firing fbi director james comey because he was investigating the alleged ties to
kardashian sisters tape visit to planned parenthood	the kardashian sisters visited planned parenthood’s headquarters in west los angeles thursday to meet with officials of the abortion vendor about its services and its difficulties with the trump administration.
summer sweat hollywood braces for possible worst box office in decade	hollywood may experience one of the worst slumps at the box office in the last decade this summer as americans grow tired of the seemingly endless number of sequels and big-budget tentpoles churned out by the film industry.
cannes film festival bans streaming-only movies going forward	taking a stand against netflix and other video streaming services the cannes film festival will ban any films that are solely digitally distributed from entering the festival starting next year.
bruce jenner’s nom de girl plummets in popularity more than any other female baby name	caitlyn is no emma olivia or eva.
caitlyn jenner looking into running for office to bring gop around on lgbt issues	friday during an interview on the bbc with host victoria derbyshire transgender advocate caitlyn jenner said she was considering running for office to promote lgbt issues from within the republican party when asked about going into politics jenner said i
jackie mason the investigators need to be investigated exclusive video)	jackie’s just about had it with all these investigations, he explains in his latest exclusive for breitbart news particularly when american taxpayers are footing the multi-million dollar bills for people to sit around and investigate things simply to make themselves feel better.
don’t call me caitlyn baby name plunges in popularity	the popularity of the name caitlyn has plummeted more than any other baby name a year after caitlyn jenner announced her new name and gender.
report hillary clinton rallies donors at haim saban’s house in beverly hills	former democratic presidential candidate hillary clinton attended a dinner at media mogul haim saban and wife cheryl’s beverly hills mansion on thursday night along with several major donors to her 2016 campaign according to a report.
watch israel advances to finals in eurovision contest	imri ziv israel’s entrant in this year’s eurovision advanced thursday night to the finals of the international singing competition.
president trump trolls rosie o’donnell’s fire comey tweet from december	president donald trump tweeted thursday that he finally agrees with rosie o’donnell the liberal actress and activist on at least one point.
fyre fest fallout organizer ja rule sued over 3m loan	rapper ja rule must personally pay back a 3 million loan relating to the ill-fated fyre festival according to a lawsuit filed by his creditor in manhattan this week.
report anti-trump hollywood wins big with president’s tax cut plan	in a column for the hollywood reporter senior editor eriq gardner notes that hollywood’s major film industry players who have often been the most vocal critics of president donald trump and his administration’s policies could actually be among the greatest beneficiaries of the president’s proposed tax cuts.
‘king arthur first summer bomb 175m film tracking for 25m debut	the summer box office season kicked off with a bang last weekend as marvel’s guardians of the galaxy vol 2 rocketed to a 146 million opening but hollywood could see its first big bomb of the season this weekend as warner bros. expensive tentpole king arthur legend of the sword is projected to open in the 25 million range.
trump fires back at no-talent stephen colbert his show was dying before he started attacking me	president donald trump fired back at stephen colbert in an interview this week following the late show host’s profanity-filled attacks on him during a segment on his show this month.
whoopi goldberg trump firing comey feels like a coup’	thursday on abc’s the view, co-host whoopi goldberg said president donald trump firing of fbi director james comey felt like a coup. goldberg said does this feel like a coup to anybody it feels like a coup first the whole
‘family guy mocks kellyanne conway in emmy mailer	peter griffin the patriarch of seth macfarlane’s long-running animated fox comedy family guy is dressed in senior white house strategist kellyanne conway’s red-white-and-blue inauguration outfit in the show’s latest emmy mailer.
abc cancels conservative tim allen sitcom last man standing despite strong ratings	abc has cancelled its tim allen-starring sitcom last man standing after six seasons the network confirmed wednesday.
nbc sets jesus christ superstar live musical for easter 2018	nbc has announced that andrew lloyd webber and tim rice’s classic broadway rock opera jesus christ superstar will be its next live production set to debut on easter sunday 2018.
rapper bow wow caught flying coach after posting private jet photo	american rapper bow wow posted images of a private jet on his instagram account claiming to be taking a glamorous trip to nyc but was soon caught out when one fan spotted him flying coach on a commercial flight.
bbc makes drama about muslim rape gang doesn’t mention islam	the bbc has made a drama about girls affected by muslim rape gangs with no mention of islam in press releases or the trailer the writer claiming there was no religious basis for this”.
ftc reminds celebrity social media influencers about brand endorsement rules	the federal trade commission has issued letters warning big-name celebrities about the laws and guidelines that regulate how they promote products via their respective social media accounts.
amy schumer’s snatched shredded by critics lazy sloppy, and racist	amy schumer is set to return to the big screen this weekend for the first time since 2015’s trainwreck with the mother-daughter kidnap caper snatched alongside veteran actress goldie hawn but negative early reviews from critics could threaten to spoil crucial word-of-mouth and dampen the film’s mother’s day weekend box-office prospects.
report john oliver used tax loophole created by trump on 9.5m nyc apartment	last week tonight host john oliver has emerged as one of the leading anti-donald trump personalities in the entire media landscape with his biting critiques often shared discussed and debated in the mainstream press but according to a wednesday report in the observer the late-night funnyman used a tax loophole created in part by trump in the 1970s to allegedly avoid paying a large tax bill on the 9.5 million new york city apartment he purchased in 2014 just weeks after deriding tax breaks for the wealthy during a segment on his hbo show.
southern poverty law center tv series to explore far-right extremism’	the southern poverty law center splc is developing a documentary series centered on far-right extremism and president donald trump.
dwayne the rock johnson run for presidency a real possibility’	following the success of donald trump’s presidential campaign actor and former wrestler dwayne the rock johnson has revealed he is also considering a bid for the presidency.
‘whitewashing outrage after actor zach mcgowan cast as hawaiian war hero	social media users are decrying the casting of zach mcgowan a white actor who has been tapped to play a native hawaiian in the world war ii drama ni’ihau as the latest example of hollywood whitewashing.”
stephen colbert corrects audience for cheering news of comey firing	late show host stephen colbert was surprised on tuesday when his audience cheered lustily as he informed them that president donald trump had fired fbi director james comey evidently the left-leaning colbert fans had not yet heard the news that
celebrities melt down over comey firing full blown constitutional crisis’	hollywood celebrities reacted with shock and anger tuesday following the white house’s announcement that president donald trump has fired fbi director james comey.
‘daily show’s trevor noah we still see ourselves as fake news’	the daily show host trevor noah has revealed that the show’s producers still consider themselves to be fake news, and believe the term was stolen from them by president donald trump.
