title	text
german court rules parents have no right to dead child’s facebook account	(reuters a german court rejected a mother’s demand on wednesday that facebook grant her access to her deceased daughter’s account.
google’s sergey brin secretly building world’s biggest air yacht	google co-founder sergey brin is secretly building the world’s largest airship at a cost of up to 150 million to serve both as the ultimate luxury yacht and rapid transit for remote natural disasters.
demand for nintendo switch leads to nintendo and apple battling for scarce parts	having trouble getting your hands on nintendo’s newest hit console the problem may be in your pocket.
evergreen professor protesters forced me to hold class in park over safety concerns	evergreen state college professor bret weinstein wrote in the wall street journal that security concerns caused by student protesters have forced him to hold class off campus.
report facebook lobbied irish leader over data protection commissioner position	documents obtained under the freedom of information act have revealed how facebook coo sheryl sandberg lobbied the irish taoiseach enda kenny over the replacement candidate for the role of data protection commissioner in ireland.
mainstream media silent on evergreen state college’s day of absence chaos	mainstream media outlets have yet to cover the protests that have erupted at evergreen state college over a progressive professor’s refusal to participate in a day in which white community members were asked to leave campus.
nasa announces solar probe which will touch the sun’	at a press conference on wednesday nasa announced the parker solar probe, which will be sent on a mission to examine and research the sun up close.
a meme is born donald trump covfefe typo breaks the internet	a tweet sent out by president trump last night birthed a new meme based entirely around a typo covfefe.
fbi arrests mexican motorcycle gang accused of hacking and stealing over 150 jeep wranglers in california	the federal bureau of investigation fbi have arrested a mexican motorcycle gang who are accused of hacking and stealing over 150 jeep wranglers for spare parts in southern california.
uber fires employee at center of google lawsuit following ultimatum	uber has fired senior engineer anthony levandowski after he refused to return allegedly stolen documents to his previous employer waymo which is owned by google parent alphabet.
delingpole trump pulls out of paris internet shrieks that end is nigh	let’s not get too excited just yet about reports that president trump has made up his mind to pull the u.s out of the paris climate agreement we don’t know the terms and conditions it is entirely possible that what we end up with is a fudge designed to appease both warring factions in the administration but actually resulting in a muddled cop out which pleases no one.
us investigation may lead to new solar panel tax	a new investigation into crystalline silicon photovoltaic cells may result in increased tariffs on solar panels imported into the united states.
university of arizona scholar creates a feminist brand of physics to combat bigotry	a researcher at the university of arizona claims to have created a feminist brand of quantum physics to weed out the bigotry that she believes follows from a study of newtonian physics.
robot preacher gives automated blessings and beams lights from hands	a new robot preacher allows users to receive automated blessings in different languages before it beams light from its hands.
evergreen student activists demand video of them screaming cursing at college president be taken offline	students at evergreen college demanding the suspension of a professor who opposed a school event asking white students and staff to leave campus are demanding that a video of their protest efforts published online be taken down.
uzbekistan bans video games that threaten security political stability’	the uzbekistan government has officially turned 34 video game titles into digital contraband within its borders.
facebook criticizes new german hate speech law for social media	facebook has criticized new german hate speech law that would see social media companies pay up to 50 million in fines if they fail to remove hate speech on their platform.
‘metalimbs want to provide users with an extra set of hands controlled by their feet	“metalimbs, an extra set of robotic arms and hands which can be controlled with your feet have been created by a group of japanese engineers.
amazon’s stock tops 1,000 for the first time	new york ap amazon the e-commerce giant that has changed how much of the world shops for books toilet paper and tvs hit a new milestone its stock topped 1,000 for the first time.
tech leftists target lambdaconf over alleged red-pilling speaker	lambdaconf an annual functional programming conference based in colorado is once again in the left’s crosshairs for failing to censor its speakers.
bill would reward hacking the department of homeland security to find vulnerabilities	the hack dhs act has been introduced in order to help address key vulnerabilities in the department of homeland security.
silicon valley elites continue to push for universal basic income	silicon valley elites continue to push for a universal basic income in america that would give all citizens a guaranteed annual income from the government.
students that stormed ice official’s lecture at northwestern may be disciplined	a lawyer for a student group that interrupted an event at northwestern featuring an ice official is outraged that the students may be disciplined by the university.
report facebook pays army of filipinos to police offensive material	facebook reportedly pays an army of filipino content curators to police content on the social network’s platform.
evergreen state college president gives into demands of leftist student protesters	the president of evergreen state college has announced he will comply with the demands of students who protested professor bret weinstein who refused to participate in a campus event where white students and staff were asked to leave school grounds.
court case could protect students secretly recording teachers	a new court case in the state of maine could protect public school students who secretly record their teachers during class.
news outlets fight google apple facebook over eu privacy laws	an alliance of news publishers have claimed that new changes to european union privacy laws will potentially kill their businesses and give too much power to google apple and facebook.
leftist media outlet attacks marines on memorial day over toxic masculinity’	left-wing news outlet vox attacked marines on memorial day claiming in an article that the marine corps has a toxic masculinity problem.”
uber ceo travis kalanick loses mother in boating accident father injured	the mother of uber ceo travis kalanick died and his father was seriously injured in a power boat accident on pine flat lake last friday according to a fresno county sheriff’s report.
report google will help vietnam censor toxic content	vietnam’s government claims that google’s parent company alphabet will help censor toxic content in the country according to a statement.
u.s may ban laptops on all flights into and out of the country	(reuters the united states might ban laptops from aircraft cabins on all flights into and out of the country as part of a ramped-up effort to protect against potential security threats u.s homeland security secretary john kelly said on sunday.
fake news despite reports donald trump roars back on twitter	president donald trump spent much of his saturday sending unfiltered messages on twitter despite reports that said white house attorneys would start vetting his messages and tweet less.
report cost of target’s data breach nearing 300 million	the cost estimate to retail giant target is now approaching 300 million for the damage from its massive 2013 data breach where the credit card information of some 40 million customers was lost to hackers.
university of arizona scholar identifies as a hippopotamus in academic journal	a visiting scholar at the university of arizona claimed he identifies as a hippopotamus in a recently published article in an academic journal.
facebook’s zuckerberg fight against nationalism struggle of our time’	facebook chief mark zuckerberg choked up while speaking about an illegal immigrant dreamer during his harvard commencement speech and declared that the fight against the forces of nationalism is the struggle of our time.”
mark zuckerberg calls for universal basic income in america	facebook ceo mark zuckerberg closed his commencement speech at harvard this week by discussing the need to modernize democracy and calling for universal basic income in america.
the red pill wins women in film award at digifest	the red pill a documentary about the men’s rights movement won the award for women in film at this year’s digital hollywood digifest.
‘far cry 5 official announce trailer	﻿far cry 5 brings ubisoft’s open-world first-person shooter to the united states pitting players against a religious doomsday cult that has taken over the remote fictional hope county in montana.
tactical augmented reality gives soldiers a video game-style hud on the battlefield	“tactical augmented reality will provide a video game-like heads-up display to soldiers for superior situational awareness in the field.
7 virtue-signaling celebrities silent on massacre of coptic christians	christians brutalized at the hands of muslims in the middle east are a minority seemingly ignored by the elite cultural left.
ai bot dylan computer composer creates over 100,000 new folk songs	“bot dylan, an a.i music composer has created over 100,000 new folks songs after studying 23,000 tradition irish tunes.
bitcoin rival ethereum rallies to over 2,700 increase in 2017	the increasingly popular crypto-project ethereum has had a strong 2017 increasing in value by more than 2,700 percent since the beginning of the year.
western washington university hosts workshop on role of white privilege in america	western washington university is hosting a workshop on reducing the impact of white privilege, according to a report on the university’s website.
report 83 percent of cybersecurity employees say their time is wasted fixing basic it problems	83 percent of system security professionals say their time is wasted fixing other it problems at work according to a survey.
students demand resignation of professor who opposed event asking white students staff to leave campus	student activists at evergreen state college in olympia washington are demanding the resignation of a professor who refused to participate in an event in which white students and staff were asked to leave campus.
hacker vandalizes harvard newspaper site to troll mark zuckerberg	a hacker took control of harvard’s student newspaper to troll one of the ivy league institution’s famous former students mark zuckerberg ahead of his commencement address to the class of 2017.
michael steele on mark zuckerberg’s universal income idea why doesn’t he start with his own organization’	michael steele former rnc chairman and co-host of steele and ungar on siriusxm potus channel 124 joined breitbart news daily host alex marlow on friday to discuss trump’s trip abroad the election of greg gianforte in montana and other topics in the news.
pro-labor group report claims tesla factory had high injury rate	a pro-labor group reported that tesla’s non-union factory in silicon valley had suffered an 87 percent higher injury rate than the unionized auto industry average in 2014-15.
egypt bans 21 websites for supporting terrorism and publishing lies’	the egyptian government announced on wednesday that it was blocking a list of 21 websites for having content that supports terrorism and extremism as well publishing lies.”
‘titanfall 2 monarch’s reign gameplay trailer	respawn entertainment is bringing a new titan to its giant mech first-person shooter titanfall 2 with the latest free content update monarch’s reign.
milo and pamela geller protest sharia-advocate linda sarsour in nyc	former breitbart senior editor milo yiannopoulos and pamela geller held a protest against sharia-advocate linda sarsour’s speaking engagement at the city university of new york cuny on thursday.
berkeley police arrest local professor for allegedly beating trump supporters with bike lock	eric clanton a former professor at diablo valley college has been arrested by berkeley police for allegedly attacking pro-trump activists with a bike lock during rallies that took place on april 15.
china tries to censor ai victory over go champion	the chinese government attempted to prevent its citizens from watching google’s alphago ai defeat the world’s best player.
feminists sue university for failing to protect them from mean internet comments	a feminist student group at the university of mary washington has filed a title ix lawsuit against the institution for failing to protect them from mean comments on the internet.
lobbyists for google facebook trying to stop new online privacy protections	lobbyists representing tech firms such as google and facebook are fighting against new proposed online privacy protections.
‘i could punch her in the face libertarian student faces backlash after researching faculty bias	a student at the university of wisconsin green bay is facing a severe backlash after conducting research into faculty bias at her institution.
report how silicon valley is trying to topple trump	recode has published a report outlining how democrats are attempting to use contacts within the tech world to further their political causes.
virtual fidget spinner rockets to the top of ios app charts	fidget spinners the heir apparent to fad toys like pogs tamagotchi and furby is now also dominating the digital realm becoming the most-downloaded free ios app.
student allegedly hacks school computer system changes grade	a student at the university of central florida was arrested on wednesday after over allegations he hacked into the school grading system changing a failing grade.
report obama’s nsa conducted illegal searches on americans for years	a report claims that the nsa under the obama administration regularly violated american privacy protections while intercepting overseas communications.
qatar claims news agency hacked fake news causes chaos	the communications office of the government of qatar announced on tuesday that the website of the qatar news agency qna was hacked and a false statement attributed to his highness the emir sheikh tamim bin hamad al-thani has been published.”
advertisers bow to activist left begin pulling ads from hannity	a number of companies have pulled ads from fox news host sean hannity’s show hannity after he pledged to continue investigating circumstances surrounding the death of murdered dnc employee seth rich.
left-wing funder bankrolls news sites that leaked trump-duterte phone transcript	tel aviv the intercept news website and a philippine news outlet that collaborated to publish an alleged transcript of president donald trump’s private phone call with philippine president rodrigo duterte are both directly tied to liberal billionaire ebay founder pierre omidyar.
bipartisan bill will keep the nsa out of your inbox	the house of representatives is considering a bill that would prevent the nsa from conducting warrantless searches through u.s citizens e-mail accounts.
report facebook moderators told to remove dehumanizing posts about refugees but not holocaust denial posts	facebook moderators have been ordered to remove dehumanizing posts about migrants and refugees but not holocaust denial posts in countries where it’s outlawed according to a new report.
reuters facebook signs buzzfeed vox others for original video shows	(reuters facebook inc fb.o has signed deals with millennial-focused news and entertainment creators vox media buzzfeed attn group nine media and others to make shows for its upcoming video service which will feature long and short-form content with ad breaks according to several sources familiar with the situation.
report facebook flooded with revenge porn sextortion’	during a single month facebook assessed nearly 54,000 cases of revenge porn and sextortion on the platform according to a report by the guardian.
target to pay out 18.5 million to close investigation into 2013 data breach	retail giant target will reportedly pay 18.5 million to 47 states in order to bring a close to the investigation into their 2013 data breach.
middlebury announces disciplinary measures for students involved in charles murray protest	middlebury college has announced in a press release disciplinary measures taken against students who participated in the protests that led to the derailment of a speaking event featuring charles murray.
chinese student who praised free speech in u.s condemned by china’s communist party	an international student from china who gave the student address at the university of maryland’s commencement ceremony is facing a backlash in her home country after her speech went viral.
college republicans cleared of wrongdoing after being threatened with sanctions over free speech board	the hood college republicans have been cleared of wrongdoing after being threatened with sanctions for posting conservative quotes on the club’s bulletin board on campus.
hackers may have obtained names of over 16,000 florida concealed permit holders	hackers may have breached a database and obtained the names of over 16,000 concealed carry permit holders in florida the state’s department of agriculture and consumer services announced the breach this week.
report uber underpaid nyc drivers by millions of dollars over past two and a half years	uber said it mistakenly underpaid its new york city drivers by millions of dollars since 2014 for two and a half years according to a report.
twitter co-founder i thought free speech could make the world a better place’ i was wrong’	twitter co-founder and medium creator evan williams criticized the concept of free speech during an interview with the new york times on saturday.
jeff bezos wants to create permanent cities on the moon	amazon ceo jeff bezos believes that it’s time to go back to the moon but this time to stay in permanent lunar cities.
u.s appeals court rules wikipedia can pursue nsa surveillance lawsuit	(reuters a federal appeals court on tuesday revived a wikipedia lawsuit that challenges a u.s national security agency nsa program of mass online surveillance and claims that the government unconstitutionally invades people’s privacy rights.
scholars behind penises cause climate change hoax claim academia is overrun by left-wing zealots’	following the publication of their hoax paper that claimed male genitalia causes climate change two professors are claiming that academia is overrun by left-wing zealots.”
‘this is only the beginning’ isis supporters celebrate manchester attack on social media	isis supporters celebrated the terrorist attack at an ariana grande concert in manchester england on monday night issuing warnings that the attack was only the beginning.”
megaupload founder kim dotcom claims seth rich was dnc leaker offers to work with special counsel mueller	internet entrepreneur kim dotcom has released a statement claiming knowledge of connections between murdered dnc staffer seth rich and wikileaks.
tech services industry increases h-1b lobbying efforts reports show	the foreign outsourcing industry is increasing its h-1b visa lobbying efforts to ensure the flow of foreign labor continues as the trump administration conducts a full legal review of the program.
delingpole how social media’s useful idiots responded to the manchester suicide bomb	this morning i woke to learn that 22 people had been killed and upwards of 50 injured by a muslim terrorist bomber at an ariana grande pop concert in manchester england so based on past events i thought i’d predict how it would pan out on social media.
university of oregon spends 23,400 to rename buildings amid concerns of racism	the public university of oregon spent 23,000 on research before deciding whether or not to change the name of several buildings on campus which students claim have racist histories.
campus free speech group denied university recognition after screening anti-pc film	a campus free speech group at lawrence university in appleton wisconsin was denied institutional recognition after they screened the anti-pc film can we take a joke?
leftists bemoan islamophobia backlash on social media following manchester terrorist attack	leftists took to twitter monday night to tweet about their fears of islamophobia following the terrorist attack at an ariana grande concert in manchester england.
6 things we learned from facebook’s leaked internal rules on terrorism sexual imagery and violence	recently leaked internal memos outlining facebook’s guidelines for removing content have provided unique insight into what is permissible and what is forbidden on the social media platform.
‘destiny 2 official gameplay reveal trailer	the last city has fallen and the traveller has been taken now the guardians must regain their powers and rebuild their arsenals to save the earth in destiny 2.
‘prey review an immersive though sometimes repetitive sci-fi shooter rpg hybrid	arkane studios revival of the prey franchise may not be the epic adventure we were once promised but it’s a thrilling science fiction adventure in its own right if you don’t fault its reliance on some well-worn tropes.
school board member resigns after posting about trump assassination on social media	a member of an iowa school board resigned last thursday after a social media post in which he referenced donald trump being assassinated came to light.
ex-ibm developer found guilty of stealing trade secrets for china	a former ibm developer has pled guilty to stealing trade secrets for the chinese government.
new report claims china killed cia sources between 2010 to 2012	a newly released report claims that the chinese government killed or imprisoned as many as 20 cia sources between 2010 and 2012.
harvard to begin testing anti-aging drug	researchers at harvard medical school will begin trials of a new drug that has been proven to reverse aging in mice.
students ask boston university alumni to withhold donations over school’s ties to fossil fuel industry	boston university alumni are threatening to withhold donations until the institution divests from companies that are exploring fossil fuel reserves.
robocop dubai unveils new street-patrolling robot police officer	the world’s first operational robocop has been unveiled in dubai allowing citizens to pay fines report crimes and contact police headquarters.
dr michael savage gives president trump a prescription to fix his presidency	during thursday’s savage nation monologue michael savage gave president trump a specific series of steps he should follow to solve his problems with leftists intent on creating a false enemy called russia.”
report new cyber attack worm uses seven leaked nsa tools wannacry used just two	a new cyber attack worm uses seven leaked tools from the national security agency nsa) according to a report.
cnn’s fareed zakaria blasts silencing of conservatives on campuses in commencement address	cnn’s fareed zakaria offered a blistering criticism of the rise of political intolerance and anti-intellectualism on college campuses in a commencement address at bucknell university on sunday.
zuckerberg’s open borders group enforcing immigration law hurts public safety’	facebook ceo mark zuckerberg’s open borders organization says president trump’s push to improve enforcement of immigration laws hurts public safety.”
california unemployment falls to lowest rate in 16 years	california’s unemployment rate fell to 4.8 percent in april the lowest rate since the top of the dot-com bubble in december 2001.
mark zuckerberg we need a global superstructure to advance humanity’	facebook founder mark zuckerberg stated his belief that the world is in need of a global superstructure in a recent article from the new york times magazine.
a meme is born donald trump touches glowing orb with middle east leaders	president donald trump broke the internet once again during the inauguration of the global center for combating extremist ideology sunday in riyadh the capital of saudi arabia.
delingpole penises cause climate change’ progressives fooled by peer-reviewed hoax study	a pair of hoaxers convinced an academic journal to peer-review and publish their paper that the penis is a social construct causing climate change.
twitter co-founder it’s a very bad thing if twitter helped to elect trump	twitter co-founder evan wiliams spoke recently about president trump’s use of the twitter social media platform to help him to win the presidency going so far as to apologize on twitter’s behalf.
bbc holds personal data threatens to contact employers if users leave offensive comments on articles	the bbc has revealed it will use people personal information to stop them being disruptive or offensive online as well as threatening to inform users employer if they are perceived to have broken the law.
revealed barack obama talked directly with mark zuckerberg about facebook concerns	former president barack obama spoke directly with facebook ceo mark zuckerberg during the latter’s drafting of a 5,700-word manifesto outlining the company’s future goals.
