title	text
israel no intention to initiate military conflict with syria	tel aviv defense minister avidgor liberman said monday that israel will not initiate a attack against syria in the near future rejecting intense speculation that the next round of conflict is on the horizon.
jewish pilgrims arrested attempt to visit joseph’s tomb holy site	tel aviv about 20 jewish pilgrims were arrested sunday morning when they attempted to visit the jewish holy site of joseph’s tomb in nablus the idf said.
world view egypt’s president sisi hands contested red sea islands over to saudi arabia	contents egypt’s president al-sisi hands contested red sea islands over to saudi arabia us troops in multinational force and observers mfo not affected by island handover
white house warns syria may be prepping chemical attack	syria has denied white house allegations that it may be preparing a new chemical attack insisting again that it has never used such arms.
saudi airline denies pic of plane purportedly at israel’s airport	saudi arabian airlines has denied the authenticity of a picture circulating on social media of one of its planes parked at ben gurion airport.
catholic bishops chairman deeply concerned about scotus decision on travel ban	following monday’s u.s supreme court ruling that allows much of president trump’s travel ban to go immediately into effect the chairman of the u.s bishops committee on migration released a statement expressing grave concerns over the ruling.
picture unveiled shows palestine mufti visiting nazi camp	jerusalem auction house kedem auction is slated to reveal some very rare images on tuesday to enthusiastic bidders the pictures in question which were never exposed to the public before depict mutfi hag amin al-husseini visiting an unidentified german camp and are dated back to sometime between 1942 and 1943.
israelis following syria attacks golan heights like living in a war zone’	residents of israel’s golan heights region have been rattled in recent days by a spate of incoming errant mortar shells from the ongoing fighting between assad regime forces and rebel groups just across the border in syria.
strategic strength narendra modi donald trump see destroying radical islamic terrorism as top priority’	on monday president donald trump welcomed india’s prime minister narendra modi for their first official in-person meeting in which both leaders agreed that their top priority is to destroy radical islamic terrorism and ending terrorist safe shelters sanctuaries and safe havens.”
iraqi general mosul battle to end within days’	a senior iraqi general has said that the city of mosul will be liberated from the islamic state within days as counterterrorism units close in on the group’s few remaining strongholds three years after the terror organization declared a caliphate in syria and iraq.
captain of cargo ship claims it tried to avoid u.s navy destroyer in deadly collision	the captain of a philippine-flagged cargo ship that collided with a u.s navy destroyer this month in japanese waters has claimed his ship flashed lights and tried to steer hard to the right to avoid the u.s warship according to a report by reuters.
iran battles opium epidemic addicts double in six years	according to a new study from iran’s drug control organization the number of people regularly consuming drugs has grown from 1.3 million six years ago to at least 2.8 million today the vast majority of these drug users favor opium which flows in from afghanistan.
white house warns syria you will pay if you use chemical weapons again	the white house warned syrian dictator bashar al-assad that if he uses chemical weapons again he will face another response from president donald trump.
ice report 77 of 1.18 million foreign students studying in u.s from asia	a new report for the student exchange visitors program sevp generated by the department of homeland security’s dhs immigration and customs enforcement ice shows that of the 1.18 million students from foreign countries studying at colleges and universities in the united states 77 percent are from asia.
chinese communist youth league launches dating service	a branch of the chinese communist youth league has set up a dating service for young activists to find a partner state media has reported.
vatican laments forcible removal and disappearance of chinese bishop	in a rare move the vatican expressed its displeasure with the chinese government monday for the recent disappearance of bishop peter shao zhumin of wenzhou.
as battle for marawi rages philippine military say captured priest still alive	the battle for the southern philippine city of marawi continues and may even be widening but military officials had one piece of good news to offer on monday according to other hostages the catholic priest kidnapped by islamic state militants is still alive.
ramadan ends with violent protests in indian-held kashmir	violent protests erupted in the india-held kashmir region during the last week of ramadan holiday culminating in violent demonstrations after the eid prayers marking the end of the muslim holy month at least ten injuries were reported by indian media.
idf strikes hamas targets in gaza after terror rocket fired into israel	tel aviv israel on monday night carried out retaliatory strikes against hamas positions in the gaza strip after a projectile was launched into the jewish state earlier in the day.
islamic state supporters hack ohio governor john kasich’s state website	an islamic state-supporting hacker group replaced ohio governor john kasich’s website with a jihadist message on sunday.
photo depicting new saudi crown prince at prayer sparks online debate	tel aviv it appears that the struggle among saudi arabia’s royals in which crown prince mohammad bin nayef was replaced by another prince mohammad the son of king salman who had been serving as deputy crown prince has continued to hold the attention of the local population as some criticism focuses on the new heir to the throne.
report u.s.-backed syrian democratic forces take back a quarter of raqqa	the uk-based ngo syrian observatory for human rights reported this week that the syrian democratic forces sdf) a u.s.-backed kurdish-arab coalition has taken back a quarter of the city of raqqa from the islamic state.
china’s wild swings on the game of golf rich man’s game influential international sport	communist china has a love-hate relationship with the game of golf–building courses shutting them down and banning construction of new courses over the years but when chinese president xi jinping visited president donald trump at his mar-a-lago golf course estate in florida this spring the ball seems back in china’s court.
china debates banning hand-on-heart patriotic gesture deeming it too american’	a member of china’s legislature the national people’s congress has proposed banning individuals from holding their hearts with their hands during the playing of the national anthem suggesting the gesture is too american for chinese patriots.
violent weekend in cuba 30 ladies in white arrested again trying to attend mass	over thirty members of the ladies in white a peaceful catholic dissident group in cuba were violently arrested over the weekend for attempting to attend sunday mass including leader berta soler.
chelsea manning attends nyc pride parade following prison release	wikileaks source chelsea manning attended an lgbt pride parade in new york city on sunday following her release from prison last month.
watch israeli minister defends hebron’s cave of the patriarchs from un	israel’s deputy foreign minister tipi hotovely issued a warning monday to countries participating in a united nations effort to classify a jewish holy site as palestinian that they risked participating in fake history and aggravating the israeli-palestinian conflict.
trump can win travel ban case at supreme court simply by enforcing it	trump can win simply by following through on the travel ban then declaring it fulfilled before the court hears the various challenges to the case cutting the gordian knot of legal theories and advancing his policies.
top ex-israeli security officials back u.s bill to cut palestinian funding over terrorist salaries	tel aviv a group of former top israeli security officials have expressed support for a proposed u.s legislation that would cut off american funds to the palestinian authority until it stops the payment of salaries to terrorists and their families.
hamas official arabs must not confuse resistance with terror’	tel aviv hamas politburo member khali elhayeh has requested that arab countries not confuse terrorism with resistance in a sermon for al-fitr the holiday marking the end of the month of ramadan.
supreme court reinstates trump travel ban from muslim-majority countries	the supreme court of the united states announced monday that it will review the lower court injunctions blocking enforcement of president donald trump’s executive order barring travel from six muslim-majority countries.
world view hezbollah’s nasrallah makes delusional speech about foreign fighters attacking israel	contents hezbollah’s nasrallah makes delusional speech about foreign fighters attacking israel saudis report close relationships between hezbollah and qatar how to do a generational analysis of the mideast.
exclusive whistleblower most probable that nsa has recordings of trump phone calls with james comey	william binney a former highly placed national security agency nsa official turned whistleblower surmised it is very likely in fact most probable that the nsa has recordings of president donald trump’s conversations with former fbi director james comey.
idf stray fire from syria hits un positions in golan heights	the idf on monday said that stray fire from syria reportedly hit a united nations peacekeeping position in the golan heights no injuries were reported.
report muslim extremists drive anti-semitic violence in western europe	individuals of muslim background stand out among perpetrators of anti-semitic violence in western europe according to a new report by the university of oslo center for research on extremism the next highest offending group in the same survey was found to be left wing extremists.
after terror attacks paris steps up plans for eiffel tower protection wall	paris french officials have announced that construction of an eight-foot high bulletproof glass wall around the eiffel tower will begin in september after revelations that the most recent jihadist attacker may have been targeting the iconic parisian monument.
syrian army warns israel following idf retaliatory strikes	the syrian army on sunday issued a warning to israel following two idf retaliatory strikes on its territory in as many days for spillover fire from the war-torn country.
israel un ambassador danny danon unifil turning blind eye to hezbollah	israel’s ambassador to the united nations on saturday slammed the international body’s force patrolling the border with lebanon saying it was ignoring obvious hezbollah operations in the area.
iran seeks stronger ties with qatar rouhani	iranian president hassan rouhani on sunday said his country wants to bolster ties with qatar and rejected a saudi-led blockade of the gulf arab emirate.
netanyahu israel will survive long after iran’s tyrannical regime becomes history	prime minister benjamin netanyahu reassured diaspora jews visiting israel as part of the birthright taglit program that despite iran’s most recent threat against israel and the looming danger it still poses the jewish state will continue to stand strong.
islamic state supporters hack local u.s government websites with jihadist propaganda	local government agencies in ohio new york and maryland had their websites hacked by pro-islamic state cyberattackers sunday who replaced the sites with jihadist propaganda.
indian policeman stoned to death by muslim mob in kashmir	local reports say the officer deputy superintendent dsp mohammad ayub pandith who was not in uniform was confronted by a group of worshipers after being seen taking photos on his cellphone he then panicked and drew out his gun firing at the group and injuring three people which led to the incident.
israel strikes syrian army two days in row following projectile fire into golan heights	the idf on sunday said it attacked a series of targets belonging to the syrian military after several projectiles from neighboring syria landed in the israeli-controlled golan heights for a second day.
report qatari ruling family importing hezbollah fighters for protection	tel aviv sheikh tamim bin hamad al thani the ruler of qatar has started enlisting the help of hezbollah fighters from lebanon to secure his family and his rule according to a report in youm7 seventh day) an egyptian newspaper aligned with president abdel fattah al-sissi.
donald trump president obama knew about russia and did nothing about it’	president donald trump continued pushing back on the left’s obsession with russian attempts to influence the 2016 election criticizing former president barack obama for failing to respond properly.
report democrats behind dossier that fbi used to justify spying on trump associates	author paul sperry reports that the senate is probing the partisan nature of a dc opposition research firm which produced a dossier on then-presidential candidate donald trump in 2016 alleging that he is a secret agent of russian president vladimir putin recruited via blackmail with a videotape of trump and urinating russian prostitutes.
world view al-jazeera may be at the center of the gulf crisis with qatar	contents saudi arabia uae leak 13 demands to end qatar crisis uae threatens parting of the ways unless qatar meets 13 demands al-jazeera takes center stage in the gulf crisis
israel shelves plan for pluralistic prayer section at western wall	the cabinet on sunday suspended a government-approved plan to establish a pluralistic prayer pavilion at jerusalem’s western wall following calls by prime minister benjamin netanyahu’s ultra-orthodox coalition allies to scrap the deal.
trump mulling camp david-style summit to confront islamic extremism	tel aviv president donald trump is considering a camp david-style summit in an effort to resolve tensions between u.s allies in the arab world trump also intends to use the summit to renew his call for the arab world confront the crisis of islamic extremism, fox news reported.
trump continues to turn the tables on the obama administration regarding russia narrative	tel aviv president donald trump on saturday continued to hammer the obama administration on twitter regarding its role in claims that russia interfered in the 2016 presidential election.
uae arab states don’t seek regime change in qatar	a top united arab emirates official said saturday the arab countries isolating qatar do not seek to force out the country’s leadership over allegations it supports extremist ideology but are willing to cut ties altogether if it does not agree to their demands.
hezbollah leader hundreds of thousands of islamic fighters could battle israel in next war	hezbollah leader sayyed hassan nasrallah said on friday that a future war waged by israel against syria or lebanon could draw thousands of fighters from countries including iran and iraq.
egyptian police say they foiled church bombing	egyptian police said on saturday they foiled a church bombing by arresting a cell including the would-be attackers two months after suicide bombers killed dozens of church goers in two attacks.
israeli official denies deal reached with trump administration to freeze settlement construction	an israeli government official denied on friday a report that an agreement had been reached with the trump administration to refrain from issuing any tenders for new construction projects in the west bank until the end of this year.
assad leads prayers in rare appearance outside damascus	syrian president bashar al-assad led eid al-fitr prayers in the central city of hama on sunday appearing in public outside the capital for the first time in a year.
watch threats cause iran’s president rouhani to flee anti-israel al-quds rally	a week after being heavily criticized by iranian supreme leader ayatollah ali khamenei president hassan rouhani was heckled friday during an annual pro-palestinian rally in tehran with protesters comparing him to a former state head who was impeached and later exiled.
the hill–bannon trump’s strategy is let the warfighters fight the war’	in contrast to the prior administrations of george w bush and barack obama according to the president’s chief strategist stephen k bannon donald trump prefers to leave tactical military decisions up to the military max greenwood writes at the hill:
watch israel releases video of retaliatory airstrikes targeting syrian military	tel aviv the israel defense forces idf on saturday night released video footage showing the israel air force earlier today carrying out three retaliatory strikes targeting syrian army positions inside syria from which ten mortars were reportedly fired into the jewish state earlier in the day.
5 tiny island nations helping keep venezuela’s dictator in power	at a meeting of the organization of american states oas this week international diplomats had the chance to send a clear message to venezuelan dictator nicolás maduro that his authoritarian rule must end.
u.s ambassador as an american i have to support gay marriage all over the world’	the obama-appointed ambassador to romania hans klemm has stoked a national debate on the role of u.s diplomacy abroad by openly advocating same-sex marriage as the country deliberates over a proposed constitutional amendment affirming traditional marriage.
chinese state media internet users say no to u.n plea to take more refugees	as the united nations looks to guilt the developed world into opening its borders to refugees from the middle east chinese state media claim that internet users are using social media to condemn the call issuing a resounding no to the u.n.
world view india’s operation all-out brings kashmir closer to all-out war	contents india’s operation all-out brings kashmir closer to all-out war kashmir escalations building to all-out war multiple terrorist attacks across pakistan kill nearly 50
israel strikes syrian positions tanks after mortars land in golan heights	tel aviv in response to at least ten projectiles launched from syria that landed inside israeli territory the israel air force on saturday carried out retaliatory strikes targeting the positions from which the mortars originated.
exclusive arab intel source obama ignored warnings about qatar’s ties to terrorism	tel aviv president barack obama ignored repeated warnings from sunni arab countries about qatar ties to jihadist organizations in syria and other places an arab intelligence source told breitbart jerusalem.
iaf chief israel has unimaginable power to use in war with hezbollah	tel aviv if hezbollah fires rockets at israel the idf should retaliate by striking iran’s infrastructure a former deputy defense minister said wednesday at a security conference soon after the head of the country’s air force warned that israel possessed unimaginable military power to use in a future war with lebanon.
dennis rodman claims otto warmbier release an outcome of his trip to north korea	on friday former basketball star dennis rodman gave an interview in which he implied his trip to north korea played a part in securing the release of american hostage otto warmbier despite statements to the contrary from the u.s government and the warmbier family.
u.s military american airstrike kills al-qaeda boss in yemen	an american military airstrike in yemen has killed abu khattab al-awlaqi a trusted and experienced emir of al-qaeda in the arabian peninsula aqap) and two of his colleagues u.s central command centcom has announced.
ghana decision to allow two former gitmo prisoners entry in 2016 unconstitutional’	the highest court in ghana dismissed the decision by former president john mahama to allow two former guantánamo bay prisoners entry into the west african country back in january 2016 as unconstitutional.”
greek foreign ministry condemns reading of muslim prayers at hagia sophia in istanbul	the greek foreign ministry issued a statement on thursday objecting to muslim prayer services held at the hagia sophia in istanbul a televised event attended by turkish officials.
islamic state poster shows car crushing skulls run over them without mercy’	a pro-islamic state media operation called the nashir news agency published a poster calling for more vehicular jihad in the last few days of the ramadan holiday season depicting an suv driving across a mountain of skulls beneath the caption run over them without mercy.”
china bans social media sites from video streaming citing negative speech’	china has banned three social media sites the popular sina weibo acfun and ifeng.com from streaming video until they are subject to a rigorous government review of their activity the media involved include live video streaming.
russia claims nato jet attempted to intercept defense minister’s plane over baltic sea	the russian military backed up by reporters from several of russia’s state-controlled media services claims that a polish nato jet attempted to intercept or buzz a plane transporting russian defense minister sergei shoigu over the baltic sea on wednesday.
ramadan message taliban vows to keep fighting until u.s occupation of afghanistan ends	the taliban in a ramadan message says president donald trump’s administration would be making a mistake by increasing the u.s military footprint in afghanistan vowing to keep fighting until the united states-led coalition leaves.
japan takes southeast asian officials on tour of disputed south china sea	japan sent the izumo-class helicopter carrier the nation’s largest warship into the south china sea this week as part of an effort to strengthen ties with southeast asian nations angering the chinese the government.
arab states give qatar 13 demands shut down al-jazeera close turkish military base	on thursday night the associated press reported that kuwait acting as an emissary for the other nations blockading qatar presented the qatari government with a list of thirteen specific demands with just 10 days to comply.
u.n chief’s praise for uganda ignores nation’s refugee human rights crisis	united nations secretary-general antonio guterres this week hailed uganda’s exemplary approach to refugees while scolding the developed world for closing its borders a washington post article called uganda the best place in the world to be a refugee.”
washington post spy fiction obama admin choked as russia committed crime of the century’	the washington post awed the news world friday morning with a monster exclusive story promising to reveal obama’s secret struggle to punish russia for putin’s election assault. instead what it delivers is a magnum rusher opus.
rodman urges trump to make peace with kim jong-un let’s try to work this out’	in an interview that aired friday on abc’s good morning america, nba hall of fame’s dennis rodman spoke with host michael strahan about his recent trip to north korea rodman told strahan that he has seen another side of north
world view financial crisis becomes critical in illinois and puerto rico	contents voting for statehood will not save puerto rico from financial crisis puerto rico plunges into contentious bankruptcy proceedings illinois bond rating expected to be cut to junk status
turkey wants role in taking weapons back from syrian kurds after raqqa liberation	turkey’s defense minister fikri işık said in an interview friday that his government is seeking to play a role in retrieving weapons that the united states has provided syrian kurdish militias for use in the liberation of raqqa the capital of the islamic state caliphate.”
trump trolls media with three unanswered questions about the democrats and russia	on june 22 president donald trump raised three unanswered questions about the democratic party and the obama administration’s role in claims that russia interfered in the 2016 presidential election.
john bolton trump in the right place on north korea but state dept continues 25 years of failed policy	on friday’s breitbart news daily former u.n ambassador john bolton talked about the death of american student otto warmbier recently released from more than a year of captivity in north korea most of which he spent in a coma he also discussed what warmbier’s death means for america’s north korea policy moving forward bolton then looked at the one-year anniversary of the brexit vote and u.s policy toward the israeli-palestinian conflict.
university of delaware professor otto warmbier got exactly what he deserved’	a professor at the university of delaware has come under fire for arguing that otto warmbier who passed away last week after being imprisoned by the north korean government for over a year deserved his fate because he was an affluent white male.
senate judiciary chairman grassley chuck schumer knew trump wasn’t under investigation but said he was anyway	senate judiciary committee chairman chuck grassley r-ia blasted democrats on thursday particularly minority leader chuck schumer d-ny for fueling media hysteria knowing full well president trump was not under investigation for collusion with russia.
