title	text
soft core fake news playboy mag rushes to cnn’s defense in white house briefing	the white house correspondent for playboy magazine—an adult entertainment publication—sprung up during tuesday’s white house briefing to airbrush the embattled cnn’s reputation as the very fake news scandal embroiling the network received harsh treatment from deputy white house press secretary sarah huckabee sanders.
obama backdoor amnesty provided u visas for 140,000 illegal aliens	president barack obama’s deputies hugely expanded a little-known crime visa to help roughly 140,000 illegal aliens get amnesty and u.s citizenship.
trump urges republican senators forward on healthcare during white house meeting	president donald trump met with republican senators at the white house after it was clear that the healthcare bill had stalled in the senate.
gop’s richard hudson ny county district attorney cy vance needs to educate himself before criticizing national reciprocity	rep richard hudson said new york county district attorney cy vance needs to educate himself before criticizing national reciprocity.
delingpole cnn just got hit by a massive truth bomb–the facts of life are conservative	“could be bullshit i mean it’s mostly bullshit right now. and there you have it a cnn producer caught on camera frankly admitting that fake news isn’t some regrettable accident of the 24-hour news cycle fake news is cnn’s entire business model.
report repealing obamacare will not cost lives	new studies reveal that despite the dramatic rhetoric from bernie sanders and elizabeth warren repealing obamacare will not cost thousands of lives.
mexican government enters texas sanctuary city ban lawsuit	the mexican government entered the court battle over texas new sanctuary city ban by filing an affidavit of concern.”
retiring rep jason chaffetz calls for extra 2,500 for housing congressmen	even as he serves his last days in congress after announcing his retirement utah republican congressman jason chaffetz is calling for the government to give another 2,500 per month to each member of congress to help them with housing costs.
report instagram influencers ignoring ftc warnings about stealth advertising	instagram influencers largely ignore federal trade commission ftc warnings about stealth advertising according to a report.
ann coulter slams gop over obamacare lite healthcare bill like buying golden west financial right before the crash’	conservative commentator ann coulter lambasted senate republicans tuesday over the unpopular gop senate healthcare bill warning that it will merely transfer ownership of obamacare from the democrats to republicans.
marine vet in gunfight with home invasion suspects wounds three	a theodore alabama marine corps veteran took fire then returned it wounding three home invasion suspects in broad daylight.
cbo will always trash obamacare repeal if individual mandate ends	no matter what’s in a republican repeal and replace bill the cbo will forecast tens of millions of americans losing their health insurance.
mitch mcconnell delays senate healthcare vote	senate majority mitch mcconnell r-ky delayed the vote on the senate healthcare reform bill known as the better care reconciliation act bcra) until after the july 4th recess.
washpo illegal-alien recruits in military bring unsolvable security threats	more than 1,000 illegal immigrants accepted into the u.s military pose impossible-to-fix security concerns according to a report in the washington post.
white house cnn a disgrace to all of media to all of journalism’	deputy press secretary sarah huckabee sanders told the white house press corps on tuesday that cnn was a disgrace to journalism.”
pentagon leaks alleging it was unaware of white house syria statement are false’	the pentagon’s chief spokesperson said tuesday that leaks from anonymous officials alleging that it did not know in advance of a white house statement about syria are false.”
report dea paid over 20k to train local cops on data mining social media	the drug enforcement administration dea paid over 20,000 to help train local police officers in extracting hidden social media data according to a report.
narendra modi and donald trump five similarities between these two changemakers	prime minister narendra modi of india will meet united states president donald trump on monday the two world leaders are expected to discuss fostering economic business and technological ties as well as increased cooperation on security.
cnn mess unfolding carelessness internally spreads scandal as very fake news stains high level talent	the trail of damage left behind in the wake of the resignations of three top cnn editorial officials is hurting many senior top cnn talent as well.
the rebbe’s yahrzeit schneerson’s legacy lives on 23 years later	tuesday marks the 23rd anniversary of the passing of the seventh and last lubavitcher rebbe menachem mendel schneerson.
sean spicer brings back on-camera white house briefing	white house press secretary sean spicer will hold the daily press briefing on-camera tuesday according to guidance sent to journalists.
catholic bishops chairman applauds scotus landmark victory for religious liberty	the chairman of the u.s bishops usccb committee for religious liberty praised the supreme court’s monday ruling in trinity lutheran church v comer calling it a landmark victory for religious freedom.”
forgotten americans on h-1b this is complete treason’	washington d.c while americans who have lost their jobs to outsourcing are willing to speak up they remain fearfully hushed about the issue making sure their names and former employers are not released.
exclusive carter page dodgy dossier was foundation for fbi’s lengthy questioning of me	carter page the american financial consultant who was tangentially and briefly associated with donald trump’s presidential campaign told breitbart news the controversial largely discredited 35-page dodgy dossier served as the central foundation for the fbi’s extensive questioning of him about alleged russian interference in the 2016 presidential election.
white house energy week exporting our energy equivalent to exporting our freedom says expert	president of the institute for energy research thomas pyle joined breitbart news daily siriusxm host alex marlow on tuesday to discuss energy week at the white house and what the administration is doing to invigorate the energy sector in the us.
‘it was very traumatic’ americans share h-1b outsourcing stories on camera	washington d.c as americans gathered at the white house to demand president trump stick to his promise of reforming the h-1b visa and ending outsourcing of american jobs laid-off workers spoke out about their experiences.
study seattle’s minimum wage hike hurting city’s most vulnerable workers	a new study from the university of washington says that seattle’s hike in its minimum wage is hurting the very workers it was supposed to help.
shotspotter gunfire location system now in 90 cities	shotspotter a system that uses microphones to pick up the location of shootings faster than 911 calls can is now in place in over 90 cities across the country.
state dept. ivanka trump unveil human trafficking report	u.s secretary of state rex tillerson and advisor to the president ivanka trump unveiled the 2017 trafficking in persons tip report on tuesday.
family research council supreme court trending toward religious freedom	travis weber director center for religious liberty at the family research council spoke with breitbart news daily siriusxm host alex marlow on tuesday regarding the supreme court ruling in the trinity lutheran church v comer religious liberty case as well as the court’s decision to hear the case of jack phillips of colorado who refused to bake a cake for a same-sex wedding ceremony.
oops new study shows that 15 minimum wage hurts workers	new study shows that the attempt to help conditions of workers in seattle largely backfired.
student gets prison after registering dead voters for democrats	james madison university student andrew j spieles pled guilty monday in the united states district court after paying to register virginia voters prior to the 2016 presidential election.
boom consumer confidence rises again!	consumers view of current conditions rises to 16 year high.
israel no intention to initiate military conflict with syria	tel aviv defense minister avidgor liberman said monday that israel will not initiate a attack against syria in the near future rejecting intense speculation that the next round of conflict is on the horizon.
americans gather at white house to denounce h-1b outsourcing visas	white-collar professionals rallied monday in lafayette square in front of the white house urging president donald trump to curb college-graduate outsourcing via the h-1b visa program.
fitton susan rice’s unmasking material is at obama presidential library	judicial watch performed a massive public service last week we exposed how key obama spying scandal documents including the infamous susan rice unmasking records were moved to the obama presidential library.
harvard poll nearly two-thirds believe campaign exists to delegitimize trump	nearly two-thirds of the country believe that there exists a campaign to delegitimize president donald trump according to the latest harvard-harris poll.
gop field for california governor grows and chance of all-democrat runoff	the more republicans who enter the race for california governor the greater the chance that california voters may be choosing between two democrats on their general election ballots.
‘fake news! donald trump challenges cnn for phony stories’	president donald trump took a shot at cnn on tuesday highlighting their decision to retract a story about the ongoing russian investigation.
white house warns syria may be prepping chemical attack	syria has denied white house allegations that it may be preparing a new chemical attack insisting again that it has never used such arms.
police seek man for using cell phone to look up a girl’s skirt at target store	chesterfield virginia police are looking for a man accused of taking video to look up a woman’s skirt at the local target retail store.
government fails jewish school over lack of correct lgbt teaching	a london jewish school has been failed three times by government inspectors because it fell short of requirements set out in the equalities act to teach lgbt principles in general and homosexuality/gender reassignment issues in particular.
catholic bishops chairman deeply concerned about scotus decision on travel ban	following monday’s u.s supreme court ruling that allows much of president trump’s travel ban to go immediately into effect the chairman of the u.s bishops committee on migration released a statement expressing grave concerns over the ruling.
american medical association continues obamacare meme that insurance coverage is equivalent to health care access	as the republican-led senate considers majority leader mitch mcconnell’s obamacare replacement bill left-wing lobbying groups such as the american medical association ama continue to use the number of americans covered by insurance as a criterion for successful health care even if those with an insurance card have no actual access to health care.
project veritas undercover investigation cnn producer admits network hyping mostly bullsh*t trump-russia scandal for ratings’	james o’keefe’s project veritas has struck again this time a senior cnn producer was caught on camera by one of o’keefe’s investigators admitting that the network’s relentless bashing of president donald trump with the russia scandal lacks proof.
captain of cargo ship claims it tried to avoid u.s navy destroyer in deadly collision	the captain of a philippine-flagged cargo ship that collided with a u.s navy destroyer this month in japanese waters has claimed his ship flashed lights and tried to steer hard to the right to avoid the u.s warship according to a report by reuters.
justices thomas and gorsuch supreme court should take more second amendment cases	gun owners were disappointed monday when the u.s supreme court declined to take perhaps the highest-profile second amendment case in the country right now peruta v california justices clarence thomas and neil gorsuch share those gun owners disappointment declaring the need for the nation’s highest court to require adherence to its second amendment precedents.
white house warns syria you will pay if you use chemical weapons again	the white house warned syrian dictator bashar al-assad that if he uses chemical weapons again he will face another response from president donald trump.
clarence thomas scotus ought not stand by idly as gun control cripples 2nd amendment	in a june 26 dissent that accompanied the supreme court of the united states scotus announcement that it would not hear peruta v california justice clarence thomas said the court ought not stand by idly as state-level gun control cripples the second amendment.
ceasefire colorado teachers should be disarmed because police miss 4 out of 5 shots	with an estimated 20 colorado school districts allowing armed teachers and teachers from other districts to be trained to carry now ceasefire colorado’s eileen mccarron suggests teachers should be disarmed because police miss their targets 4 out of 5 times.
ice report 77 of 1.18 million foreign students studying in u.s from asia	a new report for the student exchange visitors program sevp generated by the department of homeland security’s dhs immigration and customs enforcement ice shows that of the 1.18 million students from foreign countries studying at colleges and universities in the united states 77 percent are from asia.
michael bloomberg announces 200 million program to fund liberal agenda at city level	liberal former new york city mayor michael bloomberg is pushing a 200 million program to help mayors push back against the trump administration and congress on areas such as climate change gun control and immigration.
senate majority leader mcconnell faces high stakes with healthcare vote	senate majority leader mitch mcconnell faces increasing pressure to pass the senate healthcare bill the better care reconciliation act bcra) through the senate before the fourth of july recess.
vatican laments forcible removal and disappearance of chinese bishop	in a rare move the vatican expressed its displeasure with the chinese government monday for the recent disappearance of bishop peter shao zhumin of wenzhou.
fox news’s sean hannity calls for cnn’s jeff zucker to be fired in wake of fake news scandal	fox news host sean hannity called for cnn president jeff zucker to be fired monday in the wake of a fake news scandal embroiling the anti-trump network that resulted in the resignation of three of its top journalists.
islamic state supporters hack ohio governor john kasich’s state website	an islamic state-supporting hacker group replaced ohio governor john kasich’s website with a jihadist message on sunday.
the progressive liberal a wrestling heel for the trump era	in the early 1980s professional wresting relied on an iranian sheikh and various large men with russian accents to draw the ire of fans in the late 1990s an arrogant millionaire boss served as the magnet for boos today in a sign of the times a wrestler calling himself the progressive liberal now feels the heat.
exclusive donald trump jr jeff zucker must address cnn’s very fake news scandal in on camera press briefing	president donald trump’s son donald trump jr. is calling on cnn president jeff zucker to appear before the american public and the media to personally account for and explain exactly what happened in what is now the network’s biggest scandal in its history.
cnn battle with sean spicer continues as he shuts out jim acosta	white house press secretary sean spicer repeatedly ignored cnn’s jim acosta during the white house press briefing on monday despite repeated attempts by the veteran white house correspondent to ask questions.
three employees resign from cnn amid very fake news scandal	three cnn employees have resigned amid the network’s very fake news scandal in which it was forced to retract a hit piece on president donald trump and his associates cnn said monday that three journalists including the executive editor in
supreme court declines to rule in three immigration cases	on monday the last day for orders of its term the supreme court of the united states pushed two cases with potentially far-reaching implications for immigration enforcement to its fall term.
video homeowner opens fire on robbery suspects kills two	home surveillance video shows muzzle blasts flashing in a back room and again outside as a homeowner opens fire on two robbery suspects.
supreme court decision creates bureaucratic mess in refugee admissions program	monday’s unanimous decision by the supreme court to partially restore the temporary travel and refugee bans contained in president trump’s executive order 13780 ensures that the federal refugee admissions program will be entangled in a bureaucratic mess for the remainder of fy 2017 and probably longer.
anthem says senate healthcare bill will stabilize individual market	anthem one of the largest health insurers in the country endorsed the senate healthcare bill saying that it will stabilize the individual insurance market and lower premiums.
china’s wild swings on the game of golf rich man’s game influential international sport	communist china has a love-hate relationship with the game of golf–building courses shutting them down and banning construction of new courses over the years but when chinese president xi jinping visited president donald trump at his mar-a-lago golf course estate in florida this spring the ball seems back in china’s court.
cnn jake tapper corrects misattributed george orwell quote	cnn anchor jake tapper had a twitter hiccup sunday resulting in him having to correct a simple commemoration of the birthday of 1984 and animal farm author george orwell.
whittlesey president reagan’s rose our national floral emblem a casualty of bad trade deals now challenged by president trump	june is the season for roses–resplendent in gardens and ever-present at weddings throughout the united states but then that is fitting for the rose is after all the national floral emblem of the united states declared so by presidential proclamation signed by president reagan on november 20 1986:
cair releases app for reporting hate crimes’ bias incidents’	the council on american-islamic relations cair has released an app that will allow minority groups to report hate crimes.
exclusive network insiders cnn considers prime time lineup shakeup as very fake news scandal spreads metastasizes	cnn is considering a prime time lineup shakeup as a very fake news scandal rocks the cable news platform network insiders tell breitbart news.
california democrats violate their own travel ban for important causes	the ink is barely dry on california’s newly-expanded ban on state-funded travel to texas and other states that it claims discriminate against lgbt people and this week two openly gay democrat politicians are traveling to texas violating the ban they claim to support.
firm behind trump dossier hired by planned parenthood to smear videomakers	the shadowy research firm that commissioned a dossier on president donald trump is the same firm hired by planned parenthood to create the narrative that the videos exposing the abortion business’s alleged profiteering from the sales of aborted baby parts
cbo report senate healthcare bill drops number of insured by 22 million	the senate healthcare bill otherwise known as the better care reconciliation act bcra) drops the number of insured by 22 million over the next ten years according to a congressional budget office cbo analysis.
exclusive excerpt eric bolling’s the swamp washington’s murky pool of corruption and cronyism and how trump can drain it’	the following is an exclusive excerpt from fox news channel host eric bolling’s upcoming book the swamp washington’s murky pool of corruption and cronyism and how trump can drain it in stories tuesday june 27:
harvard poll majority believe deep state leaking to unseat trump	a majority of americans believe that the deep state is trying to unseat president donald trump according to the most recent harvard-harris poll.
laid-off americans gather at white house for indian pm meet	washington d.c replaced americans due to outsourcing rallied outside the white house as president trump met with indian prime minister modi likely to discuss the h-1b visa program.
u.s border patrol partners with mexico to prosecute human smugglers	border patrol officials in southern arizona renewed a partnership with mexican immigration officials by adding a provision increasing prosecutorial efforts against human smuggling.
caddell white house and outside groups should fight together not against one another	democrat strategist and pollster pat caddell spoke with breitbart news daily siriusxm host alex marlow on monday regarding pro-trump superpac attacks on sen dean heller r-nv over his opposition to the senate healthcare bill and obama’s handling of the controversy surrounding russia’s alleged meddling in the 2016 election.
rep steve king will join launch of new angel family advocacy effort	rep steve king is set to speak along with several angel families at the launch of the new family-led group advocates for victims of illegal alien crime aviac in washington d.c on tuesday.
chelsea manning attends nyc pride parade following prison release	wikileaks source chelsea manning attended an lgbt pride parade in new york city on sunday following her release from prison last month.
commentator nancy pelosi should know when it’s time to go brought house caucus to its lowest point in 90 years’	following the fourth election loss for democrats running for seats in the house of representatives nancy pelosi d-ca is defiant in her determination to hold onto the power she wields as minority leader even as pundits and lawmakers on both sides of the aisle assert that her days are numbered.
watch colorado school teachers get trained to carry guns take out active shooters’	some colorado teachers are undergoing training to carry guns at school and amid the tensions of an attack be enabled to take out active shooters.”
rep maxine waters leads impeach 45 chant keeps town hall protesters out	nearly 100 protesters gathered outside a town hall for rep maxine waters d-ca on saturday chanting let us in.”
scotus lets ruling stand protecting second amendment rights following non-serious misdemeanors	on monday the supreme court of the united states scotus let stand a third u.s circuit court of appeals in pennsylvania ruling which protects second amendment rights following non-serious misdemeanor convictions.
‘victory’ donald trump celebrates supreme court decision to clear parts of travel ban	president donald trump celebrated the unanimous per curiam opinion by the supreme court effectively clearing lower court attempts to stay his travel ban calling it a clear victory for national security.
delingpole buffett’s vice chair al gore is an idiot who just got lucky obsessing about climate change’	al gore is an idiot who only made his vast fortune just because he happened to get lucky by obsessing about climate change.
‘most armed man in america has 200 machine guns countless grenade launchers’	mel bernstein owns 200 machine guns countless grenade launchers, and describes himself as the most armed man in america.”
caddell alleged russia election meddling only mattered to obama after hillary clinton lost	democrat strategist and pollster pat caddell spoke with breitbart news daily siriusxm host alex marlow on monday regarding pro-trump superpac attacks on sen dean heller r-nv for his opposition to the senate healthcare bill and obama’s handling of the controversy surrounding russia’s alleged meddling in the 2016 election.
supreme court rules states cannot exclude all churches from public aid	in a 7-2 ruling the court held in trinity lutheran church v comer that states cannot prohibit churches from receiving otherwise generally available benefits based purely on their being a religious institution.
scotus extends homosexual rights to include birth certificates that name unrelated spouse as second parent	a six-justice majority has extended homosexual rights to same-sex couples by ordering the state of arkansas to allow a non-related or same-sex spouse be named as the second parent on a child’s birth certificate with chief justice john roberts joining ruth bader ginsberg sonia sotomayor elena kagan anthony kennedy and stephen breyer.
car maker bmw adding 1,000 jobs at south carolina plant	german carmaker bmw has announced it is adding one thousand new jobs to its manufacturing facilities in south carolina.
how corey stewart went full troll and stunned virginia politics	when corey stewart announced his intention to challenge ed gillespie for the republican governor of virginia primary the establishment gop cringed.
trump can win travel ban case at supreme court simply by enforcing it	trump can win simply by following through on the travel ban then declaring it fulfilled before the court hears the various challenges to the case cutting the gordian knot of legal theories and advancing his policies.
