title	text
valdemir pereira	valdemir dos santos pereira born november 15 1974 in cruz das almas bahia is a brazilian former professional boxer who competed from 2001 to 2006 and held the ibf featherweight title in 2006 as an amateur pereira represented brazil at the 2000 olympics reaching the round of 16 of the featherweight bracket.
matthew kent	matthew kent born 2 july 1980 in melbourne australia he is a baseball player.
sainte-colombe landes	1 french land register data which excludes lakes ponds glaciers 1 km 0.386 sq mi or 247 acres and river estuaries.
floods in thailand	floods in thailand are regular natural disasters in thailand which happen nearly every year during the monsoon season the monsoon seasons in the country are distinct by region the southern part mirrors the malay peninsula and monsoon begins in oct and ends in march the rest of the nation has monsoons and/or frequent thundershowers from april/may through october but often lasts beyond october.
koabagou	koabagou is a town and arrondissement in the atakora department of northwestern benin it is an administrative division under the jurisdiction of the commune of kérou according to the population census conducted by the institut national de la statistique benin on february 15 2002 the arrondissement had a total population of 3,304.[1]
dolichoprosopus lethalis	dolichoprosopus lethalis is a species of beetle in the family cerambycidae it was described by francis polkinghorne pascoe in 1866 it is known from moluccas.[1]
thomas ford martyr)	blessed thomas ford died 28 may 1582) a devonshire native was a catholic martyr executed during the reign of elizabeth i.
protection face to face album)	protection is the ninth studio album by american punk rock band face to face released on march 4 2016 through fat wreck chords it was issued with the catalog number fat954 on multiple formats including compact disc vinyl and digital download.[2 this was the first release for the band on fat wreck chords in over 20 years.[3]
thomas horsten	thomas horsten born 5 january 1994 is a dutch professional footballer who currently plays as a midfielder for fc eindhoven.
jane oineza	elizabeth jane urbano oineza born july 22 1996)[3 is a filipina actress commercial model and singer a child star on goin bulilit and kung fu kids she gained local relativity on pinoy big brother oineza also received recognition overseas winning a world’s best actress certificate[4 and international emmy nomination for manika 2012).
lars ellmerich	lars ellmerich born 2 january 1961 in braunschweig is a retired german footballer.[1 he spent seven seasons in the bundesliga with eintracht braunschweig and fc 08 homburg as well as six seasons in the 2 bundesliga with braunschweig homburg ssv ulm 1846 and vfb oldenburg.
oregon collegiate conference	the oregon collegiate conference also the oregon intercollegiate conference was an intercollegiate athletic conference that existed from 1950 to 1970 the conference's members were located in the state of oregon.[1]
buford alberta	buford is a hamlet in central alberta canada within leduc county.[1 it is located 2 kilometres 1.2 mi south of highway 39 23 kilometres 14 mi west of leduc.
swimming at the 1973 world aquatics championships women's 400 metre individual medley	the women's 400 metre individual medley competition of the swimming events at the 1973 world aquatics championships took place on september 6.
fadl ibn isa	fadl ibn isa[note 1] also known as fadl ii was a prince of the al fadl an arab dynasty that dominated the syrian desert beginning in the 13th century between 1311 and 1317 he served as amir al-ʿarab which gave him authority over the bedouin tribes of northern syria on behalf of the mamluk sultanate.
le rousset-marizy	1 french land register data which excludes lakes ponds glaciers 1 km 0.386 sq mi or 247 acres and river estuaries.
jerez-xérès-sherry y manzanilla de sanlúcar de barrameda	in roman times the ceretian wines exported to the empire bore a distinguishing seal of origin.
mads kruse andersen	mads christian kruse andersen born 25 march 1978 in lolland is a danish lightweight rower he won a gold medal at the 2008 summer olympics in lightweight coxless fours together with thomas ebert eskild ebbesen and morten jørgensen making up the gold four.[1]
nordic combined at the 2015 winter universiade individual mass start 10km/normal hill	the individual mass start competition of the 2015 winter universiade was held at the sporting centre fis trbsk pleso on january 29 it consisted of a 10 km cross-country race followed by 2 jumps on the normal hill which are not judged.[1][2]
tomaszów mazowiecki county	tomaszów mazowiecki county polish powiat tomaszowski is a unit of territorial administration and local government powiat in ód voivodeship central poland it came into being on january 1 1999 as a result of the polish local government reforms passed in 1998 its administrative seat and only town is tomaszów mazowiecki which lies 49 kilometres 30 mi south-east of the regional capital ódź.
kromm	kromm is a surname notable people with the surname include:
mayo maryland	mayo is a census-designated place cdp in anne arundel county maryland united states the population was 8,298 at the 2010 census.[1 the mayo cdp of 2010 includes all of the area that used to be counted as the selby-on-the-bay cdp the beach in mayo used to be a popular weekend resort.
edith hipkins	edith hipkins 1854–1945 was a british portrait painter who exhibited regularly at the royal academy between 1883 and 1911.[1]
horst lunenburg	horst lunenburg born 18 january 1943 is a former german footballer.[1]
nowa wola podlaskie voivodeship	nowa wola ˈnɔva ˈvɔla is a village in the administrative district of gmina michałowo within białystok county podlaskie voivodeship in north-eastern poland close to the border with belarus.[1 it lies approximately 5 kilometres 3 mi south-east of michałowo and 34 km 21 mi south-east of the regional capital białystok.
new york qin society	the new york qin society chinese 約琴社 sometimes abbreviated as nyqs is a guqin society based in new york new york in america serving guqin players on the east coast of the united states of the three major qin societies in the west the other two being the north american guqin association and the london youlan qin society) this society is the most formally structured with a formal agreement of rules 1 and a more learned society approach to selecting members.
mathildidae	see text
kaze ga toori nukeru machi he	"""kaze ga toori nukeru machi he 風が通り抜ける街へ) is the 21st single by zard[1 and released 2 july 1997 under b-gram records label the single debuted at 3 rank first week it charted for 8 weeks and sold over 281,000 copies.[2]"
ichiro yoda	ichiro yoda 1860 september 28 1933 was a japanese politician who served as governor of hiroshima prefecture from july 1921 to october 1922.
list of people from west yorkshire	the list of people from west yorkshire in northern england is divided by metropolitan borough west yorkshire is a metropolitan county created in 1974 and so people from the area before this year were from the earlier west riding of yorkshire.
delhi gate lahore	coordinates 31°34′56″n 74°19′35″e 31.5822°n 74.3264°e 31.5822 74.3264
matthew barnett	matthew barnett is co-founder of the dream center and senior pastor of the angelus temple the central house of worship of the international church of the foursquare gospel in the echo park district of los angeles california.[1]
otto ender	otto ender 24 december 1875 25 june 1960 was an austrian political figure he served as the chancellor of austria between 1930 and 1931.[1]
edvardprisen	the edvard prize is a norwegian music award in given by tono copyright organization for musicians and composers the award which was first awarded in 1998 is awarded annually and can only be awarded to members of the organization the goal is to enhance the musical life and increase awareness of norwegian composers and writers and their works the prize is named after the norwegian composer edvard grieg.[1][2]
kane armory	kane armory is a historic national guard t plan armory located in kane mckean county pennsylvania united states it was designed by joseph f kuntz of pittsburgh firm w.g wilkins company the original two-story drill hall was built in 1922 for the 112th infantry of the pennsylvania national guard a two-story administrative section was subsequent added in 1929.[2]
arteni	coordinates 40°17′54″n 43°45′15″e 40.29833°n 43.75417°e 40.29833 43.75417
artifex records	artifex records was an independent record label in nashville tennessee that specialized in jazz celtic and new-age music it operated between 1992 and 1999 and was owned by peter miller a classical guitarist producer and engineer he was also the owner of nashville compact disc.[1]
candix records	"candix records was an independent american record label known primarily for releasing the beach boys first single surfin'"" candix a&r man joe saraceno and buckeye distributors russ regan are attributed with renaming the pendletones as the beach boys in an attempt to make them more marketable."
thighs high grip your hips and move)	"""thighs high grip your hips and move) is a 1980 single by jazz trumpeter tom browne the single is from his third solo album magic the vocals for the single were provided by toni smith who also helped compose the song the song hit 4 on billboard's hot soul singles chart.[1 on the us dance chart thighs high peaked at 25.[2]"
aquimarina spongiae	aquimarina spongiae is a bacterium from the genus of aquimarina which has been isolated from the sponge halichondria oshoro from the coastal area of jeju in korea.[1][3][4][5]
mahmud aghli	mahmud aghli persian حموداغلي‎‎ also romanized as maḩmūd ghlī also known as maḩmūd ghol)[1 is a village in chaybasar-e jonubi rural district in the central district of maku county west azerbaijan province iran at the 2006 census its population was 76 in 17 families.[2]
peach sauce	peach sauce is used as an accompaniment in chinese cuisine and other cuisines it is also used in peach preserves and chutney.
mount sidney virginia	mount sidney is a census-designated place in augusta county virginia the population as of the 2010 census was 663.[1]
fit to serve	fit to serve is the third studio album by american singer-songwriter a j croce released in 1998.
k s babu	k s babu is a theoretical physicist regents professor and interim head of the department of physics at the oklahoma state university.
antihemorrhagic	an antihemorrhagic antihæmorrhagic agent is a substance that promotes hemostasis stops bleeding).[1 it may also be known as a hemostatic also spelled hæmostatic agent.[2]
myopa dorsalis	myopa dorsalis is a species belonging to the family conopidae subfamily myopinae.
cheryl blaylock	cheryl blaylock is an american puppeteer actress and comedian on eureeka's castle from 1989 to 1995 baylock is originally from kalamazoo michigan before she starred in the title role on eureeka's castle she was performed on sesame street and in the muppets take manhattan after eureeka's castle blaylock was on other shows like oobi the adventures of timmy the tooth the reunion and blue's room she also was a cinematographer for act as if.
mircea dobrescu	mircea dobrescu 5 september 1930 6 august 2015 was a flyweight boxer from romania he competed at the 1952 1956 and 1960 olympics and won a silver medal in 1956 losing to terence spinks on points.[2 he won two more silver medals at the european championships in 1955 and 1957.
david tennant cape politician)	sir david tennant kcmg 10 january 1829 29 march 1905 was a cape politician statesman and the second speaker of the legislative assembly of the cape colony he was in fact the longest serving parliamentary speaker in south african history holding the position for nearly 22 years.[1]
inter-cooperative agricultural confederation	the inter-cooperative agricultural confederation spanish confederación intercooperativa agropecuaria or coniagro is an argentine organization that gathers several agricultural cooperatives around the country.
roman catholic diocese of trivento	the roman catholic diocese of trivento latin dioecesis triventinus is a latin rite suffragan diocese in the ecclesiastical province of the metropolitan archdiocese of campobasso-boiano in the ecclesiastical region of abruzzo-molise southern italy.[1 2]
marc beaudoin	marc beaudoin born 1935 died 2012 is a judge and former politician in the canadian province of quebec he served on the montreal city council from 1978 to 1986 as a member of mayor jean drapeau's civic party and was a member of the montreal executive committee i.e. the municipal cabinet) in 1991 he was appointed as a judge on the quebec superior court.
zakpo	"zakpo monatsschrift für zeitkunst zeitbetrachtung satire und karikatur ""zakpo monthly journal of contemporary art viewing of the times satire and caricature"" was an artists magazine published in 1930 in karlsruhe germany by the actor hermann brand and the artists karl hubbuch erwin spuler and anton weber who had been art students at badischen landeskunstschule in karlsruhe two issues were published in may and june 1930.[1]"
ferrier lecture	"the ferrier lecture is a royal society lectureship given every three years on a subject related to the advancement of natural knowledge on the structure and function of the nervous system"".[1 it was created in 1928 to honour the memory of sir david ferrier a neurologist who was the first british scientist to electronically stimulate the brain for the purpose of scientific study.[1]"
jang sin-kweon	sinkweon jang is a south korean long-distance runner.[1 at the 2012 summer olympics he competed in the men's marathon finishing in 73rd place.
antonio lupis	antonio lupis 16 february 1649 1701 was a prolific italian writer.
2010 garmin–transitions season	the 2010 season for garmin–transitions began in january with the tour down under and ended in october at the japan cup as a uci protour team they were automatically invited and obliged to attend every event in the protour the team's manager is former cyclist jonathan vaughters who has led the team since its inception in 2003.
congenital hereditary endothelial dystrophy	congenital hereditary corneal dystrophy ched is a form of corneal dystrophy which presents at birth.
temple beth israel niagara falls new york)	temple beth israel hebrew י שראל‎‎ was a synagogue located at 905 college avenue in niagara falls new york founded in 1898[3][4 and formally incorporated in 1905[5 as an orthodox synagogue,[6 it hired its first rabbi in 1916,[7 and joined the conservative movement in 1931.[6]
fascism	fascism ˈfæʃɪzəm is a form of radical authoritarian nationalism,[1][2 characterized by dictatorial power forcible suppression of opposition and control of industry and commerce,[3 that came to prominence in early 20th-century europe the first fascist movements emerged in italy during world war i before it spread to other european countries opposed to liberalism marxism and anarchism fascism is usually placed on the far-right within the traditional left–right spectrum.[4][5]
vincent vitetta	vincent vitetta born 1 october 1925 in nice france is a former french cyclist professional from 1951 to 1961 he was the winner of the tour d'algérie in 1952 he ended his career as an independent racer in 1961.
alwatan and asnan international	the alwatan and asnan international is a men's squash tournament held in south surra kuwait.
papaya club)	papaya is a club on zrće beach on pag island in croatia papaya features several pools for pool parties as well as several bars and an open-air dance floor papaya is one of the top 20 clubs in the world according to dj mag.[1]
ajinomoto	ajinomoto co. inc 味の素株式会社 ajinomoto kabushiki-gaisha is a japanese food and chemical corporation which produces seasonings cooking oils tv dinners sweeteners amino acids and pharmaceuticals in particular it is the world's largest producer of aspartame with a 40 global market share.[2 25 october 2000
richard raffan	"richard raffan born 1943 is a well-known woodturner author and instructor who has helped popularize the craft of woodturning since the 1970s he was a part of the art turning movement that saw turned objects move into galleries where they are presented as works of art.[1 although he has created large and valuable works of exotic woods in his books he has also championed simple utilitarian works created for daily use he finishes much of this work simply using vegetable oil and beeswax and has written admiringly of the patina of well used wooden items an indescribable surface that begs for a caress of the hand--that's what i think wood should provide.""[2]"
magombera chameleon	kinyongia magomberae commonly known as the magombera chameleon is a species of chameleon the holotype of this species was discovered inside the jaws of a twig snake in the magombera forest of tanzania by andrew marshall of the university of york the snake was startled by marshall and dropped the chameleon which was examined and discovered to be a new species.[1 although this particular specimen did not survive another one was found which did survive.[2]
hikosaki station	hikosaki station 彦崎駅? hikosaki-eki is a train station in okayama okayama prefecture japan.
col de l'échelle	col de l'échelle el 1762 m. in italian colle della scala is a mountain pass in the alps in the department of hautes-alpes in france it is the lower mountain pass between france and italy and connects vallée de la clarée and vallée troite commune of névache dora riparia basin).
u.s seals ii the ultimate force	u.s seals ii the ultimate force is a 2001 direct-to-video action film starring michael worth the movie was written by boaz davidson and michael d weiss and directed by isaac florentine.
salla tira	"salla tira aymara salla rocks cliffs tira cradle,[2 rock cradle"" also spelled sallatira is a mountain in the willkanuta mountain range in the andes of peru about 5,200 metres 17,060 ft high it lies in the puno region melgar province nuñoa district it is situated between the siriri valley and the qinamari valley east of surapata.[1]"
gölköy bolu	gölköy is a village in the district of bolu bolu province turkey as of 2010 it had a population of 323 people.[1]
dario badinelli	dario badinelli born 10 august 1960 in ghedi brescia is a retired italian triple jumper.
alpha tau omega fraternity house west lafayette indiana)	alpha tau omega fraternity house also known as maltese manor is a historic fraternity house located at purdue university in west lafayette tippecanoe county indiana it was built in 1920 and is a 2 1/2-story rectangular tudor revival style brick and stone building it has a truncated hipped roof parapeted tower and platform porch extending across the front facade a one-story kitchen addition was built in 1940 and a three-story addition in 1963 the building was remodeled in 995 after a fire on the second and third floors it has housed the indiana gamma omicron chapter of alpha tau omega fraternity since its construction.[2]:5–6
lavarpur	lavarpur is a village in gandhinagar district in the indian state of gujarat.
francis rush	francis j rush may 25 1921 june 15 1985 was a democratic member of the pennsylvania house of representatives 3]
garston dock railway station	garston dock railway station served garston liverpool merseyside england it was situated on the east side of dock road.
jim vienneau	james francis jim vienneau born september 18 1926 in albany new york is a retired music producer he is best known for producing the song it's only make believe by conway twitty.
pd-0298029	pd-0298029 is a drug which acts as a selective antagonist for the muscarinic acetylcholine receptor m4 it was developed for the treatment of parkinson's disease but poor bioavailability and rapid metabolism in animal studies have meant its use is largely limited to in vitro research into the m4 and other muscarinic receptors.[1][2][3]
vitaliy nikolayevich bubentsov	vitaliy nikolayevich bubentsov russian итали убенцов born february 12 1944 murmansk is a russian artist working in the genres of portrait landscape still-life and thematic picture executed in various techniques he is an honored artist of the russian federation a member of the artists union of russia a member of the international association of visual art aiap unesco.
daf sb220	the daf sb220 was a full-size single-decker bus chassis produced by daf bus international now known as vdl bus chassis in the 1980s and 1990s.
mount sinai beth israel	mount sinai beth israel is an 799-bed full-service tertiary teaching hospital in new york city.[1 originally dedicated to serving immigrant jews living in the tenement slums of the lower east side of manhattan it was founded at the turn of the 20th century now it serves the diverse population of lower manhattann including manhattan's lower east side as well as chinatown gramercy the west village chelsea as well as many neighborhoods in brooklyn.
bill talbert	william franklin billy talbert september 4 1918 february 28 1999 was an american tennis player and administrator.[2]
opennms	opennms is a free and open-source enterprise grade network monitoring and network management platform it is developed and supported by a community of users and developers as well as by the the opennms group offering commercial services training and support.
thor bjarne bore	thor bjarne bore born 10 january 1938 is a norwegian newspaper editor and politician for the liberal party.
dryas integrifolia	dryas integrifolia is a species of flowering plant in the rose family known by the common names entireleaf mountain-avens white mountain-avens northern white mountain avens,[1 and mountain avens.[2 it is native to northern parts of north america where it occurs from alaska across canada to greenland.[1][2 it is a common species of the arctic and it is probably the most common flowering plant on some of the western arctic islands.[2]
chaos computing	chaos computing is the idea of using chaotic systems for computation in particular chaotic systems can be made to produce all types of logic gates and further allow them to be morphed into each other.
skymningssagor	skymningssagor was a children's programming originally airing over svt's svt 1 between 24 october 1988-16 november 1998.[1 every episode includes a story-tale told usually told by silent pictures and narrator among the stories were the sven nordqvist books about pettson and findus the intro and outro scenes showed a model-landscape with a town and a rural district at twilight and a model train travelling across model railway tracks the picture would them zoom in and out the location where the story was set it was accompanied by a melody played on the piano.
sugar musical)	sugar is a musical with a book by peter stone music by jule styne and lyrics by bob merrill it is based on the film some like it hot which was adapted by billy wilder and i.a.l diamond from a story by robert thoeren and michael logan it premiered on broadway in 1972 and was staged in the west end twenty years later.
star omnibus company	the star omnibus company and its predecessor the andrews star omnibus company was a bus operator in london between 1892 and 1908.
ningalenne communistakki	ningalenne communistakki malayalam ിങ്ങളെന്ന മ്മ്യൂണിസ്റ്റാക്കി meaning you made me a communist is a malayalam socio-political play by kerala people's arts club kpac) this was the second and most popular stage play of kpac this drama propelled kpac into the forefront of kerala cultural scene and played a historical role in popularising the communist movement in kerala during 1950's eventually leading to the establishment of first democratically elected communist ministry in the world in 1957 in kerala under e m s namboodiripad.[1]
aeroper destinations	this list includes domestic and international destinations once served by aeroperú the flag carrier airline of peru from 1973 to 1999 besides a multitude of domestic routes the network with its hub at lima's jorge chavez international airport spanned throughout latin america at times cities in the united states were served too as well as between 1996 and 1997 regional routes out of el dorado international airport in colombia.
bohemia jazz fest	bohemia jazz fest is an annual jazz festival in the czech republic it was started in 2005 by czech-born jazz guitarist rudy linka the festival travels to different historic squares in cities throughout the country during the month of july beginning on prague's old town square and ending in budweis in the past bohemia jazz fest has visited prachatice domazlice plzen tabor and brno.[1]
cnaphalocrocis latimarginalis	cnaphalocrocis latimarginalis is a moth in the crambidae family it was described by hampson in 1891 it is found in india tamil nadu).[1]
motocross madness 2013 video game)	motocross madness is a motocross racing video game that was developed by bongfish and published by microsoft studios it was released on april 10 2013[1 on xbox live arcade it is a sequel to two pc games 1998's motocross madness and 2000's motocross madness 2 which were developed by rainbow studios who have since moved on to making the mx vs atv series.
alliance pipeline	alliance canada enbridge income fund holdings inc.[1 50% and veresen inc.[2 50%)
le collet-de-dèze	1 french land register data which excludes lakes ponds glaciers 1 km 0.386 sq mi or 247 acres and river estuaries.
