title	text
mount francis	mount francis is a massive ridgelike mountain 2,610 metres 8,560 ft high that overlooks tucker glacier from the north standing between tyler glacier and staircase glacier in the admiralty mountains of antarctica it was mapped by the united states geological survey from surveys and u.s navy air photos 1960–62 and was named by the advisory committee on antarctic names for henry s francis jr. director of the international cooperation and information program at the office of antarctic programs national science foundation francis wintered-over at little america v station in 1958 and made visits to antarctica in other seasons.[1]
teachstreet	teachstreet inc was a web site providing information to students on local and online classes and teachers including pricing information location and teacher background and training it also provided online business management tools for teachers and schools the site was free to students and included student reviews and teacher recommendations.
plxdc1	57125
gyula hornyánszky	gyula hornyánszky pest 22 september 1869 budapest 31 january 1933) was a hungarian classical scholar[1 and member of the hungarian academy of sciences.
geobukseon bridge	the geobukseon bridge hangul: 거북선대교) also called the second dolsan bridge hangul: 제2돌산대교) is the main bridge on the yeosu road between udu-ri dolsan-eup and jonghwa-dong linking the yeosu port with dolsan island across the south sea of korea.[1 the bridge is floating cable-stayed bridge with 464m 35+82+230+82+35m length and its construction started in june 2008 it opened in april 2012 and carries four lanes of motor vehicle traffic.[2 the new link was intended to reduce traffic congestion on the first dolsan bridge which opened in 1985 and act as an important infra-structure link during the yeosu expo which had been held from may 2012 for three months the bridge was built by contractor daelim industrial co ltd for client iksan regional construction management administration contract cost is us$60million which includes a 460m long tunnel at one end and a 280m long approach bridge.[3]
chervonodniprovka	chervonodniprovka ukrainian ервонодніпровка russian ервоноднепровка is a village a selo in the zaporizhia raion district of zaporizhia oblast in southern ukraine its population was 64 in the 2001 ukrainian census.[2 administratively it belongs to the bilenke rural council a local government area.[2]
fiba under-19 women's basketball world cup all-tournament team	the fiba under-19 women's basketball world cup all-tournament team is a bi-annual fiba award given to the five strongest competitors throughout the tournament.
mahmudabad-e azali	mahmudabad-e azali persian حمو با زلي‎‎ also romanized as maḩmūdābād-e zalī also known as maḩmūdābād moḩammadābād muhammadābād and muhaniprābād)[1 is a village in nakhlestan rural district in the central district of kahnuj county kerman province iran at the 2006 census its population was 239 in 51 families.[2]
jean-jacques lartigue	jean-jacques lartigue s.s. june 20 1777 april 19 1840 was a canadian sulpician who served as the first catholic bishop of montreal.
wvov	wvov 1480 am is a radio station licensed to serve bridgeport alabama usa the station is owned by anthony bono through licensee partners media investments llc it broadcasts a sports format with programming from cbs sports radio.
chickasaw national wildlife refuge	chickasaw national wildlife refuge is a 25,006-acre 101.20 km2 national wildlife refuge located along the mississippi river in the northwestern part of lauderdale county in west tennessee the area is noted for a diversity of wildlife notably white-tailed deer wild turkey beaver and waterfowl established in 1985 it occupies land that was once owned by the anderson tully inc of memphis tennessee.
zion the matrix)	zion is a fictional city in the matrix films it is the last human city on the planet earth after a cataclysmic nuclear war between mankind and sentient machines which resulted in artificial lifeforms dominating the world.
werner bischof	werner bischof 26 april 1916 16 may 1954 was a swiss photographer and photojournalist he became a full member of magnum photos in 1949 the first new photographer to join its original founders.[1]:445 bischoff's book japan 1954 was awarded the prix nadar in 1955.[2]
mohamed sowan	mohamed sowan is a libyan islamist activist and politician he has been the leader of the justice and development party since its foundation in march 2012 the justice and development party is the political wing of the libyan muslim brotherhood sowan is from the city of misrata.[1 he was imprisoned by the deposed libyan arab jamahiriya government,[2 until he was released in 2006 and subsequently worked as a hotel manager.[1]
cdc25a	1c25
dartmouth destroyers	the dartmouth destroyers were a semi-professional ice-hockey team in dartmouth nova scotia they played in the now defunct canadian elite hockey league that was founded in 2005 they played their home games at the dartmouth sportsplex they were the runners up for the alexander cup which was the trophy awarded to the champions of the cehl they lost in 4 games the team and league folded during the summer of 2006.
1872 in canada	events from the year 1872 in canada.
terry humphrey	terryal gene humphrey born august 4 1949 in chickasha oklahoma is an american former professional baseball player he played as a catcher in major league baseball for nine years with the montreal expos detroit tigers and california angels.
saint liam	saint liam april 13 2000 august 22 2006 was an american thoroughbred racehorse who was voted 2005 eclipse award horse of the year honors.
nebria hikosana	nebria hikosana is a species of brown coloured ground beetle in the nebriinae subfamily that is endemic to mount hiko kyushu japan.[1]
club atlético tabaré	club atlético tabar or simply tabar is a professional basketball club based in montevideo uruguay was founded on july 9 1931 and joined the fubb in 1932 earning its promotion to the second division in 1934 and its first ascent to first in 1948 club atlético tabar managed to devote federal champion in 1960 1961 1962 1964 and 1968 after this time the club alternate passages from second to first division having its last promotion and title in 2011 returning to decline in the 2013/14 season at the metropolitan.
1951 pacific hurricane season	the 1951 pacific hurricane season ran through the summer and fall of 1951 nine tropical systems were observed this season.[1]
auchroisk distillery	the auchroisk distillery is a whisky distillery in banffshire speyside scotland it was established after dorie's well was discovered and found to have water similar to the water used by the glen spey distillery which was used by justerini brooks to produce malt whisky for their blends the wells water was used to produce a test batch of whisky at glen spey distillery and was approved which led to the start of construction of the auchroisk distillery at the site of the well in 1972 to produce whisky for the j&b blend production started in 1974.[2][3]
bidens cernua	bidens cernua is a plant species in the sunflower family widespread across much of eurasia and north america.[4][5][6][7 it is commonly called nodding beggarticks[8 or nodding bur-marigold,[9]
fusion protein	fusion proteins or chimeric \kī-ˈmir-ik proteins literally made of parts from different sources are proteins created through the joining of two or more genes that originally coded for separate proteins translation of this fusion gene results in a single or multiple polypeptides with functional properties derived from each of the original proteins recombinant fusion proteins are created artificially by recombinant dna technology for use in biological research or therapeutics chimeric or chimera usually designate hybrid proteins made of polypeptides having different functions or physico-chemical patterns chimeric mutant proteins occur naturally when a complex mutation such as a chromosomal translocation tandem duplication or retrotransposition creates a novel coding sequence containing parts of the coding sequences from two different genes naturally occurring fusion proteins are commonly found in cancer cells where they may function as oncoproteins the bcr-abl fusion protein is a well-known example of an oncogenic fusion protein and is considered to be the primary oncogenic driver of chronic myelogenous leukemia.
clinchamps-sur-orne	1 french land register data which excludes lakes ponds glaciers 1 km 0.386 sq mi or 247 acres and river estuaries.
phra nakhon si ayutthaya city)	"ayutthaya /əˌjuːt.təˈjɑː -yoot-tə-yah full name phra nakhon si ayutthaya thai ระนครศรีอยุธยา pronounced [pʰrá na.kʰɔ̄ːn sǐ a.jút.tʰa.jāː] also spelled ayudhya"" is the former capital of phra nakhon si ayutthaya province in thailand located in the valley of the chao phraya river."
xhevc-fm	xhevc-fm is a radio station on 104.5 fm in fortín veracruz it is owned by abc radio and carries a grupera format known as la más buena.
natural regional park of serre	natural regional park of serre italian parco naturale regionale delle serre is a protected natural area of calabria created at 2004 between aspromonte and la sila and crossed by two mountain ranges large forests including wood of stilo italian bosco di stilo and rivers with falss like marmarico falls cascata del marmarico near bivongi pietracupa fall near guardavalle.
judy woodruff	judith judy woodruff born november 20 1946 is an american television news anchor journalist and writer.
pooveli	pooveli english flower fence is a 1998 tamil film directed by selva the film stars karthik abbas kausalya and heera rajgopal in the lead roles the film's score and soundtrack are composed by bharadwaj while lyrics by vairamuthu.[1]
rembrandt 1940 film)	rembrandt is a 1940 dutch film directed by gerard rutten it portrays the life of the dutch artist rembrandt 1606-1669) he had previously been played by charles laughton in the 1936 film rembrandt a 1942 german film was also made starring ewald balser.
gostun prijepolje)	gostun is a village in the municipality of prijepolje serbia according to the 2002 census the village has a population of 49 people.[1 during the second world war a detachment of muslim militia was established in this village under command of selim juković.[2]
cairns california	cairns is a former settlement in placer county california.[1 cairns was located 11 miles 17.7 km northeast of lincoln.[1]
groyne	a groyne groin in the united states is a rigid hydraulic structure built from an ocean shore in coastal engineering or from a bank in rivers that interrupts water flow and limits the movement of sediment it is usually made out of wood concrete or stone in the ocean groynes create beaches or prevent them being washed away by longshore drift in a river groynes prevent erosion and ice-jamming which in turn aids navigation ocean groynes run generally perpendicular to the shore extending from the upper foreshore or beach into the water all of a groyne may be under water in which case it is a submerged groyne the areas between groups of groynes are groyne fields groynes are generally placed in groups they are often used in tandem with seawalls groynes however may cause a shoreline to be perceived as unnatural.
united states senate special election in vermont 1934	porter h dale republican
martin blessing	martin blessing born july 6 1963 is a german banker and chairman of the board of managing directors of commerzbank ag germany's second largest bank.
paco olmos	francisco olmos hernández born july 10 1970) usually known as paco olmos is a spanish professional basketball coach who is currently the head coach of the fuerza regia of the mexican liga nacional de baloncesto profesional.
1975–76 fiba kora cup	the 1975–76 fiba kora cup was the fifth edition of fiba's new competition running from 28 october 1975 to 23 march 1976 it was contested by 30 teams twelve less than in the previous edition.
sivurupitiya	sivurupitiya is a village in sri lanka it is located within central province.
akatsi district	the akatsi district was one of 18 districts in the volta region of ghana its capital and administrative centre was akatsi as of 2012 this district was divided into two resulting in the akatsi north district and the akatsi south district.
karl kurt wolter	dr karl kurt wolter 23 march 1905 7 december 1988)[1 was a german philatelist who was added to the roll of distinguished philatelists in 1976.
tetra-n-butylammonium fluoride	tetra-n-butylammonium fluoride commonly abbreviated to tbaf and n-bu4nf is a quaternary ammonium salt with the chemical formula ch3ch2ch2ch2)4n+f− it is commercially available as the white solid trihydrate and as a solution in tetrahydrofuran tbaf is used as a source of fluoride ion in organic solvents.[1]
peril's gate	peril's gate is volume six of the wars of light and shadow by janny wurts it is also volume three of the alliance of light the third story arc in the wars of light and shadow.
lászl habis	lászl habis born 20 june 1952)[1 is a hungarian politician who has been the mayor of eger since 2006 he was a member of the national assembly mp for eger heves county constituency i from 2010 to 2014.[2]
svobodny amur oblast	svobodny russian вобо́дный is a town in amur oblast russia located on the right bank of the zeya river 167 kilometers 104 mi north of blagoveshchensk the administrative center of the oblast population 58,778 (2010 census);[4 63,889 2002 census);[8 80,006 (1989 census).[9]
shrub california	coordinates 38°35′33″n 120°57′17″w 38.59250°n 120.95472°w 38.59250 120.95472
paolo ceccarelli	paolo ceccarelli is a retired canadian soccer goalkeeper who was the 1996 a-league goalkeeper of the year.
megachile relata	megachile relata is a species of bee in the family megachilidae.[1 it was described by smith in 1879.[1]
international journal of public opinion research	the international journal of public opinion research ijpor is a quarterly social science journal sponsored by the world association for public opinion research wapor and published by oxford university press.[1][2]
odetta sings dylan	odetta sings dylan is an album by american folk singer odetta issued by rca victor in 1965 it consists of covers of bob dylan songs.
rousseau institute	rousseau institute also known as jean-jacques rousseau institute or academy of geneva french académie de genève or institut jean-jacques rousseau is a private school in geneva switzerland in 1912 douard claparède 1873–1940 created an institute to turn educational theory into a science this new institution was given the name of jean-jacques rousseau to whom claparède attributed the copernican reversal of putting the child rather than the teacher at the centre of the educational process cf thomas kuhn's notion of paradigm shift).
antarctic toothfish	dissostichus mawsoni the antarctic toothfish is a species of cod icefish native to the southern ocean it is often mistakenly referred to as an antarctic cod consistent with the misnaming of other notothenioid antarctic fish as rock cods however notothenioid fishes are unrelated to cods which are in another taxonomic order the gadiformes the generic name dissostichus is from the greek dissos twofold and stichus line and refers to the presence of two long lateral lines which are very important to the species ecology the common name toothfish refers to the presence of biserial dentition in the upper jaw thought to give it a shark-like appearance the habitat of the antarctic toothfish is in subzero degree water below latitude 60°s.
homa lime kowuor	homa lime kowuor is a settlement in kenya's nyanza province.
wiley protocol	the wiley protocol is a controversial form of bioidentical hormone replacement therapy bhrt devised and advocated by author t s wiley the protocol claims to relieve the symptoms of menopause but is also promoted as increasing overall health through the recreation of a pre-menopausal woman's monthly hormonal cycle using rhythmic doses of hormones standardized to a uniform purity wiley claims the protocol is a step beyond the symptomatic treatment of conventional hormone replacement therapy.
rubidium standard	a rubidium standard or rubidium atomic clock is a frequency standard in which a specified hyperfine transition of electrons in rubidium-87 atoms is used to control the output frequency it is the most inexpensive compact and widely used type of atomic clock used to control the frequency of television stations cell phone base stations in test equipment and global navigation satellite systems like gps commercial rubidium clocks are less accurate than cesium atomic clocks which serve as primary frequency standards so the rubidium clock is a secondary frequency standard however rubidium fountains are currently being developed that are even more stable than caesium fountain clocks.[citation needed]
alexander peebles	alexander peebles 10 january 1856 11 april 1934 was a new zealand carrier bush contractor prospector mine manager farmer local politician and businessman he was born in kingsbarns fife scotland in 1856 he became a member of the coromandel county council in the 1880s he joined the whakatane road board in 1899 and served as the first chairman of the whakatane county council from 1900.[1]
med airways	med airways was a small lebanese charter airline.
viktor svezhov	viktor vladimirovich svezhov russian икто ладимирови вежов born 17 may 1991 is a russian professional footballer he plays for fc baltika kaliningrad.
bratków górny	bratków górny ˈbratkuf ˈɡurnɨ is a village in the administrative district of gmina zadzim within poddębice county ód voivodeship in central poland it lies approximately 6 kilometres 4 mi north-east of zadzim 10 km 6 mi south-west of poddębice and 41 km 25 mi west of the regional capital ódź.[1]
latin american table tennis cup	the latin american table tennis cup is an annual table tennis competition being held since 2011 it consists of men's and women's singles events only 12 invited players and no more than 3 players per association are allowed to participate in each event.[1 starting from 2013 it is recognised as the qualification event for the table tennis world cup.[2 the competitions are organized by the latin american table tennis union and sanctioned by international table tennis federation ittf and classified as r3 in rating weightings b4 in bonus weightings in the ittf world ranking.[3]
lintah darat	lintah darat [lɪnˈtah daˈrat] malay for loan shark is a 1941 film from the dutch east indies now indonesia directed by wu tsun and produced by jo eng sek.
près de toi	"près de toi ""next to you"" is french pop singer lorie's triple-platinum debut album it was released on 30 september 2001 on 29 april 2002 a special limited edition of the album was released with new packaging and extra tracks starting from 20 september 2004 the original album was sold jointly with the singer's second album tendrement."
franz conrad von hötzendorf	k.u.k feldmarschall franz xaver joseph conrad graf von hötzendorf german franz xaver josef graf conrad von hötzendorf 11 november 1852 25 august 1925) sometimes anglicised as hoetzendorf was an austrian field marshal and chief of the general staff of the armed forces of the austro-hungarian army and navy 1906–1917 he was the empire's chief of staff during the 1914 july crisis that led to the outbreak of world war i he argued persuasively for preventive war against serbia saying it was needed to hold together his polyglot empire on the verge of breaking down he later decided that austria acted too late and its failure to fight earlier was a fatal mistake he admitted his army was not ready for war and therefore emphasized the political necessity he failed to realize that germany would force him to put his chief assets on the russian front rather than serbia conrad was fearful of attacking russia and when russia nearly broke through the carpathian mountains and conrad's carpathian offensive failed italy entered the war thinking the empire was collapsing it was not a good time however as germany helped austria break through russia and the taking of serbia so conrad shifted his attention away from the balkans toward italy and russia from early 1915 his forces were increasingly dependent on german support and command without german support the austrian army was a spent force.[1 in 1917 charles i of austria also karl i of austria dismissed him as chief of staff after emperor franz joseph died and conrad's trentino offensive didn't achieve its goal he commanded an army group on the italian front until he retired in 1918.[2]
grandpa graf's	grandpa graf's also known as graf's root beer,graf's or gran'pa graf's is a carbonated soft drink that can presently be purchased in eastern and northern wisconsin groceries the beverage is a root beer flavored drink that originated in 1873 from john graf.
brian hanley biohacker)	brian hanley is an american microbiologist and founder of butterfly sciences he became known for trying to engineer his own dna using gene therapy in an effort to enhance himself and extend his life.[1 these types of efforts are known as biohacking.
2009 world archery championships men's individual compound	the men's individual compound competition at the 2009 world archery championships took place from 2–9 september 2009 in ulsan south korea 113 archers entered the competition with one withdrawal before the qualification round on 2 september as there were fewer than 128 entrants all archers qualified for the 7-round knockout round on 5 september which was drawn according to their qualification round scores the semi-finals and finals then took place on 9 september.[1]
harbor girls hamburg	st pauli roller derby is a flat track roller derby league based in hamburg in germany it consists of two trip teams an a team and a b team which compete against teams from other leagues they are called harbor girls a and harbor girls b respectively.
declan browne	declan browne born 16 june 1978 is an irish gaelic football player who played at inter-county level for tipperary for 11 years he currently plays his club football for moyle rovers.[1 he represented ireland against australia in the 2003 and 2004 international rules series.[2]
office of the chief legislative liaison united states army)	"the office of the chief legislative liaison ocll) an office of the u.s department of the army as described at the official website the chief legislative liaison cll is directly responsible to the secretary of the army for legislative affairs including formulating coordinating supervising and executing the army's congressional policy and strategy the cll ensures the overall integration of the army's efforts with congress develops comprehensive congressional engagement strategies for army senior leaders and disseminates critical information on all major congressional activities. the office’s house liaison division is the office's only special division the chief of the house liaison division of the office is the department of army's contact with that oversight body which is of unique importance to the army and the u.s executive branch because uniquely only that branch of the u.s congress the u.s house of representatives can originate funding legislation the house liaison division of the u.s department of army's office of chief legislative liaison is according to the office’s website charged with serving as the primary point of contact with members of the u.s house of representatives their staff and all relevant committees and assisting representatives and their staff in understanding policies actions operations and requirements of the army"".[1][2][3]"
2000 carolina panthers season	the 2000 carolina panthers season was the sixth season for the team in the national football league nfl) they tried to improve upon their 8–8 record in 1999 and make it to the playoffs for the second time in franchise history.
jineth bedoya lima	jineth bedoya lima arabic نا لحبش born c 1974 is a colombian journalist who was abducted in may 2000 and august 2003 in 2001 she was awarded the courage in journalism award of the international women's media foundation.
aymard moro mvé	aymard fabrice moro-mv born 1 june 1987 in libreville[3] is a gabonese footballer is currently playing for sc feignies.[4]
caroline pizzala	caroline pizzala born 23 november 1987 in marseille is a french football player who plays for french club olympique de marseille of the division 1 féminine she plays as a central midfielder and is a member of the france women's national football team.
generalized map	in mathematics a generalized map is a topological model which allows one to represent and to handle subdivided objects this model was defined starting from combinatorial maps in order to represent non-orientable and open subdivisions which is not possible with combinatorial maps the main advantage of generalized map is the homogeneity of one-to-one mappings in any dimensions which simplifies definitions and algorithms comparing to combinatorial maps for this reason generalized maps are sometimes used instead of combinatorial maps even to represent orientable closed partitions.
nothing like this song)	"""nothing like this is a song by english deep house duo blonde with english singer craig david it serves as the second single from his sixth studio album following my intuition 2016) it received its debut airplay on capital fm on 17 march 2016 and was released by parlophone and ffrr records the following day the song debuted at number 17 on the uk singles chart and peaked at number 15."
