title	text
baltimore transit alliance	the baltimore transit alliance bta was an initiative of the greater baltimore committee bringing together businesses and non-profit organizations to advocate for better public transportation in baltimore maryland the bta's priorities included construction of the red line a new east-west light rail line through baltimore and the green line an extension of the existing baltimore metro subway enhanced transit connections between baltimore and washington improved local bus service in the baltimore region and regional cooperation among the local jurisdictions that comprise the region.
brian jenkins american football)	brian o'neal jenkins born march 4 1971 is an american football coach he is the head football coach at alabama state university a position he has held since 2015 jenkins served as the head football coach at bethune–cookman university from 2010 to 2014.[1][2 his team completed the 2010 season with a record of 10 wins and 2 losses in his first year his team was declared the mid-eastern athletic conference co-champions and the team qualified for the 2010 ncaa division i football championship series playoffs.[3]
ptolemaic decrees	the ptolemaic decrees were a series of three decrees by synods of ancient egyptian priests they were issued under the hellenistic ptolemaic dynasty which ruled egypt from 305 bc to 30 bc in all three the benefactions of the reigning pharaoh especially towards the priesthood are recognised and religious honours are decreed for him.
beehive fence	a beehive fence is a fence which is built to deter elephants based on their natural fear of bees.[1]
billy budd opera)	billy budd op 50 is an opera by benjamin britten to a libretto by the english novelist e m forster and eric crozier based on the short novel billy budd by herman melville originally in four acts it was first performed at the royal opera house london on 1 december 1951 it was later revised as a two-act opera with a prologue and an epilogue.
zhang jianhong	zhang jianhong 張建紅 march 6 1958 1 december 31 2010[2]) pen name li hong 力虹) was a freelance writer playwright poet and democracy activist in china he was born on march 6 1958 in ningbo city of zhejiang province.
chaetapatrobus	chaetapatrobus valentinae is a species of beetle in the family carabidae the only species in the genus chaetapatrobus.[1]
the 11th hour video game)	trilobyte
hist1h3j	3wkj 3b95 2c1j 3ayw 3wa9 3u4s 5avb 2cv5 5av5 3u31 2uxn 3azk 2c1n 5c11 3qo2 3x1v 5c13 4a0j 4u68 5av8 4llb 3u5o 1o9s 4ft2 4hon 3w99 3zvy 4z0r 5avc 1ct6 1q3l 3o37 3w97 3sow 3kmt 4ym6 4a7j 3uee 2kwk 4f4u 3uef 3uig 4bd3 3azl 4qbr 4f56 3afa 4lka 5cpk 5ffv 3v43 5ch1 3u5p 3azi 3u5n 3azh 3uik 4qbq 1u35 4uy4 2ot7 5av9 2b2w 3u3d 3azf 3w98 4i51 4x3k 4fwf 2b2t 2b2v 4a0n 2kwj 3waa 3qj6 5dah 3azg 3aze 3x1t 3riy 2l75 3a1b 2vpg 4qbs 3o35 5cpj 3zg6 4ym5 3azj 2ri7 3azn 3avr 5cpi 2lbm 3w96 3o34 2m0o 4l7x 5ch2 5av6 3azm 4up0 3x1s 2ox0 3uii 3sou 4n4h 4tn7 1cs9 3x1u 4lxl 2b2u 2oq6 3rig 5c3i 4yhp 5b24 5d6y 4yhz 4z2m 5hjd 5hjc 5hjb 5b2i 5hyn 5fb0 5fb1 5iql 5b2j 5jin
4th soviet antarctic expedition	the fourth soviet antarctic expedition was an expedition in antarctica led by aleksandr gavrilovich dralkin.
arlene horowitz	arlene horowitz born 1946 is an american women's activist and the author the women's educational equity act.[1]
ner class p1	the ner class p1 lner class j25 was a class of 0-6-0 steam locomotives of the north eastern railway.[1][2 class p1 was a development of class p having a boiler four inches longer and a firebox six inches longer to accommodate these the wheelbase was increased by nine inches the cylinder stroke was also increased by two inches.
yerba buena band)	yerba buena is a grammy award-nominated fusion band the group was founded by venezuelan musician and producer andres levin
klf15	2ent
mama's little pirate	mama's little pirate is a 1934 our gang short comedy film directed by gus meins it was the 132nd our gang short 44th talking episode that was released.
pexicopia proselia	pexicopia proselia is a moth of the gelechiidae family it was described by common in 1958 it is found in australia where it has been recorded from queensland.[1]
winter falls	winter falls is a waterfall located in the silver falls state park at the east end of the city of salem in marion county in the u.s state of oregon it is located in a privileged area on the west foothills where mount hood national forest meets with the middle santiam wilderness several prominent waterfalls are located in the park along trail of ten falls south falls lower south falls lower north falls and drake falls—among others.
list of nesis storms	"the northeast snowfall impact scale nesis is a scale used to categorize winter storms in the northeast united states.[1 the scale was developed by meteorologists paul kocin and louis uccellini and ranks snowstorms from category 1 ""notable"" to category 5 ""extreme"") only two historical blizzards the 1993 storm of the century and the north american blizzard of 1996 are rated in the 5 extreme category the scale differs from the saffir–simpson hurricane scale and fujita scale which are used to classify tropical cyclones and tornadoes respectively in that it takes into account the number of people affected by the storm.[2 the scale as devised is intended chiefly to assess past storms rather than assist in forecasts.[3]"
democratic party gambia)	the democratic party was a political party in the gambia the party was founded during the pre-independence period in the colony of bathurst currently the national capital banjul) ahead of the 1962 general elections the dp merged with the muslim congress party to form the democratic congress alliance.[1]
alles kann besser werden	alles kann besser werden german everything can get better is the fifth studio album by german recording artist xavier naidoo released by naidoo records on october 9 2009 in german-speaking europe.
seán boylan	seán boylan is an irish former gaelic football manager from dunboyne county meath he retired from his position as manager of the meath gaa senior football team on the evening of 31 august 2005 after twenty-three years in charge during his time with meath he managed the team to four all-ireland senior football championships 1987 1988 1996 1999) three national football league titles and eight leinster senior football championships.
hippolyte montplaisir	hippolyte montplaisir march 7 1839 june 20 1927 was a canadian politician.[1]
2015 zayar shwe myay f.c season	
pampero wind)	the pampero is a burst of cold polar air from the west southwest or south on the pampas in the south of brazil argentina and uruguay this wind often violently picks up during the passage of a cold front of an active low passing by it takes the form of a squall line and there is a marked drop in temperature after its passing the pampero is most common at winter in the southern hemisphere principally between may and august) during the summers in the region around buenos aires the pampero storms are a welcome feature marking the end of long periods of high humidity and extreme heat.
makete district	makete district is one of the six districts of njombe region of tanzania its administrative seat is the town of iwawa it is bordered to the north and west by the mbeya region to the east by the njombe district and to the south by the ludewa district it is divided into six divisions and 17 wards makete district was founded in 1979 with the policy of the ujamaa before this part of iringa region belonged to njombe district.
japanese sawshark	the japanese sawshark pristiophorus japonicus is a species of sawshark in the family pristiophoridae this shark has a long narrow rostrum its first dorsal fin originates behind the tips of the pectoral fins and its caudal fin is angled almost straight in line with the body the japanese sawshark reaches an maximum length of up to 1.36 m 4 ft 6 in).
belgian first division men's handball)	the belgian eerste klasse dutch or division 1 french is the name of the professional handball league of belgium.
sepahan novin f.c.	sepahan novin football club persian اشگا وتبا پاها وین‎‎ is an iranian professional football team based in esfahan iran they are the reserve team of sepahan f.c and currently compete in the 2011–12 iran football's 3rd division.
neural groove	the neural groove is a shallow median groove of the neural plate between the neural folds of an embryo the neural plate is a thick sheet of ectoderm surrounded on either side by the neural folds two longitudinal ridges in front of the primitive streak of the developing embryo.[1]
2016–17 yale bulldogs women's basketball team	the 2016–17 yale bulldogs women's basketball team represented yale university during the 2016–17 ncaa division i women's basketball season the bulldogs led by second year head coach allison guth played their home games at john j lee amphitheater of the payne whitney gymnasium and are members of the ivy league.
wilhelm jakob rink von baldenstein	wilhelm jakob rink von baldenstein 1624–1705 was the prince-bishop of basel from 1693 to 1705.[1]
minibus driver awareness scheme	the minibus driver awareness scheme usually abbreviated to midas is a training and registration scheme for drivers of minibuses in the uk.
immortalized disturbed album)	"immortalized is the sixth studio album by american nu metal band disturbed the album was released on august 21 2015 by reprise records and is disturbed's first studio album since asylum 2010) marking the longest gap between two studio albums in their career with 98,000 album-equivalent units in its first week immortalized is disturbed's fifth consecutive number-one debut on the united states billboard 200 chart they are the third band in history to achieve this feat after metallica and dave matthews band.[3 the band also found cross-over success in the album's third single a cover of the 1964 song the sound of silence by simon garfunkel which marked disturbed's highest ranked single on the billboard hot 100 at number 42[4 and has since become disturbed's biggest song since down with the sickness""."
wampum pennsylvania	wampum is a borough in lawrence county pennsylvania united states the population was 717 at the 2010 census.[1]
jean rey square	jean rey square french place jean rey dutch jean reyplein is a square in the european quarter of brussels belgium inaugurated in 2001.
sylwia kapusta	sylwia kapusta-szydłak born 8 december 1982 is a road cyclist from poland she participated at the 2007 2008 2009 and 2011 uci road world championships.[1]
john munro surgeon)	john munro 1670–1740) the third son of sir alexander munro of bearcrofts was an important member of edinburgh university.
banco de oro–equitable pci bank merger	the banco de oro-equitable pci bank merger 2004–2006 was a plan by the sm group of companies and banco de oro universal bank the fifth-largest bank in the philippines to merge with equitable pci bank the third-largest bank the merger was part of a long-term goal of banco de oro to become one of the largest names in the philippine banking industry it was closed on december 27 2006 with the formation of banco de oro unibank inc.
lauri kristian relander	lauri kristian relander 31 may 1883 9 february 1942 was the second president of finland 1925–1931) a prominent member of the agrarian league he served as a member of parliament and as speaker before his election as president.[2]
antoine gaston de roquelaure	antoine gaston de roquelaure 1656-6 may 1738 was a french nobleman and marshal of france he was also grandson to another marshal antoine de roquelaure.
puntillita	puntillita manuel licea lamouth yareyal holguín 4 january 1921 havana 4 december 2000 was a cuban popular singer.[1 puntillita was active in the 1940s and 1950s and later gained notice when he joined other elderly cuban musicians to form the afro-cuban all stars and the associated group of singers who recorded the buena vista social club with american guitarist ry cooder.
ruth winifred howard	ruth winifred howard beckham march 25 1900 february 12 1997 was an african-american woman who received a doctorate degree ph.d. in psychology.[1][2 she was active in many psychology organizations and received instruction from florence goodenough.[3]
michael pineda	michael francisco pineda paulino born january 18 1989 is a dominican professional baseball starting pitcher for the new york yankees of major league baseball mlb) he has also pitched in mlb for the seattle mariners.
cycas campestris	cycas campestris is a species of cycad in the genus cycas native to southeastern papua new guinea in the lowland region near port moresby it grows in open grassy locations often in areas with frequent grass fires.
john cairns politician)	john cairns 1859 may 1923 was labour mp for morpeth from the 1918 general election until his death which led to the morpeth by-election 1923.
regulator watts	regulator watts was a rock band from washington d.c from 1996 to 1998 when the band broke up dunham formed a new band abilene and sless-kitain joined bluetip.
mycobacterium goodii	mycobacterium goodii is an acid-fast bacterial species in the phylum actinobacteria and the genus mycobacterium.[1]
acrotomodes	acrotomodes is a genus of moth in the family geometridae.
westerlee groningen	westerlee is a village in the dutch province of groningen it is located in the municipality of oldambt about 3 km west of the city of winschoten.
guzmania andreettae	guzmania andreettae is a species of plant in the bromeliaceae family it is endemic to ecuador its natural habitat is subtropical or tropical moist montane forests.
u.s route 341	
carl von rokitansky	baron carl von rokitansky german carl freiherr von rokitansky czech karel rokytanský 19 february 1804 23 july 1878) was a bohemian physician pathologist humanist philosopher and liberal politician.[a]
comedy cluj	comedy cluj is an international film festival of comedy film organized annually in october in cluj-napoca transylvania romania.[1]
mimotriammatus nigrosignatus	mimotriammatus nigrosignatus is a species of beetle in the family cerambycidae and the only species in the genus mimotriammatus it was described by breuning in 1972.[1]
aslyn	heather aslyn mitchell nash born september 21 1980)[1 is an american pop singer and songwriter from atlanta georgia she has released two full-length albums lemon love and the dandelion sessions as well as a 4-disc ep she is also the sister of three members of the band georgia.
yichunentulus	yichunentulus is a genus of proturans in the family acerentomidae.[1]
public square watertown new york)	public square is an open mall that lies in the center of watertown new york the square is listed as public square historic district on the national register of historic places encompassing 58 contributing buildings one contributing site and three contributing objects.
nosavana laosensis	nosavana laosensis is a species of beetle in the family cerambycidae it was described by stephan von breuning in 1963.[1]
county meath	"county meath /ˈmiːð meedh irish contae na m or simply an mhí is a county in ireland it is in the province of leinster and is part of the mid-east region it is named after the historic kingdom of meath from midhe meaning middle"").[1 meath county council is the local authority for the county according to the 2016 census the population of the county is 194,942.[2]"
equestrian at the 2002 asian games team dressage	team dressage equestrian at the 2002 asian games was held in busan equestrian grounds busan south korea on october 8 2002.
death game	death game also released as the seducers,[1 is a 1977 american horror film directed by peter s traynor and written by anthony overman and michael ronald ross the film stars sondra locke colleen camp seymour cassel and beth brickell it was shot in 13 days in october 1974,[2 but not released until may 1977.[3][4]
maggie macinnes	maggie macinnes born 29 august 1963 in glasgow scotland is a scottish folk singer and clàrsach player who performs primarily in scottish gaelic she is the daughter of folk singer flora macneil.[1]
harmonic maass form	in mathematics a weak maass form is a smooth function f on the upper half plane transforming like a modular form under the action of the modular group being an eigenfunction of the corresponding hyperbolic laplace operator and having at most linear exponential growth at the cusps if the eigenvalue of f under the laplacian is zero then f is called a harmonic weak maass form or briefly a harmonic maass form.
second battle of villers-bretonneux	british empire
olnut	olnut or ernut is a district of the old armenian region of taron.
electrona tasmania	electrona is a small residential area on the d'entrecasteaux channel in southern tasmania it grew up around the electrona carbide works which were established in 1909.
halysidota leda	halysidota leda is a moth of the family erebidae it was described by druce in 1890 it is found on dominica guadeloupe and martinique the habitat consists of hygrophilic and mesophilic areas.
barringtonia payensiana	barringtonia payensiana is a species of woody plant in the lecythidaceae family it is endemic to peninsular malaysia it is threatened by habitat loss.
municipal corporations act 1835	the municipal corporations act 1835 5 6 wm iv. c.76) sometimes known as the municipal reform act was an act of the parliament of the united kingdom that reformed local government in the incorporated boroughs of england and wales the legislation was part of the reform programme of the whigs and followed the reform act 1832 which had abolished most of the rotten boroughs for parliamentary purposes.
adamu garba talba	adamu garba talba born 15 august 1952 was elected senator for the yobe south constituency of yobe state nigeria taking office on 29 may 2007 he is a member of the people's democratic party pdp).[1]
the day after the day the martians came	"""the day after the day the martians came is a short story by american writer frederik pohl first published in harlan ellison's dangerous visions it shows how humans can and will laugh at and hate any minority group it centers on a group of reporters in a bar shortly after humans have made first contact with martians who are passing the time by retelling dumb polack jokes as dumb martian jokes."
herb brunning	herb brunning 26 may 1886 12 december 1947 was an australian rules footballer who played with st kilda in the victorian football league vfl).[1]
robert s stevens judge)	robert s stevens 1916 september 9 2000 was a politician who rose to the level of california state senator[1 before being appointed judge by governor jerry brown in 1977 he left the bench in 1981.[2]
beriev be-112	the beriev be-112 is a proposed amphibian aircraft with two propeller engines projected to carry 27 passengers the beriev firm currently lacks a production amphibian aircraft in this size.
turbonilla swani	turbonilla swani is a species of sea snail a marine gastropod mollusk in the family pyramidellidae the pyrams and their allies.[1][2]
drawdown climate)	climate drawdown is the point at which greenhouse gas concentrations in the atmosphere begin to decline on a year-to-year basis.[1]
1595 in scotland	events from the year 1595 in the kingdom of scotland.
sacramento state men's rowing team	the sacramento state men's rowing team is a collegiate sports club representing the sacramento state university in rowing the program is a club sport not affiliated with the university athletic department and is governed by elected club officers started in 1984 by students with head coach steve gallant the crew is a member of the western intercollegiate rowing association wira) whose participants are mostly non-pac-10 schools on the west coast.
society for experimental mechanics	society for experimental mechanics sem is a professional organization for engineers and scientists studying the design and implementation of experiments to characterize materials structures and systems formed in 1943 as the society for experimental stress analysis sesa) early work focused on methods such as photoelasticity and strain gages.[1 society historical records refer to the society as sesa through the 1984 fall sesa meeting in milwaukee wi[2 and start referring the society as sem with the 1985 spring sem meeting in las vegas nv.[3 the society has expanded to include topics including modal analysis digital image correlation split hopkinson pressure bar residual stress and biomaterials.
baz luhrmann	mark anthony baz luhrmann /ˈbæz lʊərmən/;[2 born 17 september 1962 is an australian film director screenwriter and producer best known for red curtain trilogy comprising his romantic comedy film strictly ballroom 1992) the romantic drama romeo juliet 1996) and the pastiche-jukebox musical moulin rouge 2001) his 2008 film australia is an epic historical romantic drama film starring hugh jackman and nicole kidman his 2013 drama the great gatsby based on f scott fitzgerald's 1925 novel of the same name stars leonardo dicaprio whom he also used in romeo juliet and tobey maguire.
elizabeth wilmot countess of rochester	elizabeth wilmot countess of rochester 1651 20 august 1681 was an english heiress and the wife of john wilmot 2nd earl of rochester the libertine. she was born elizabeth malet,[1 the daughter of john malet of enmore manor and unton hawley.
erythro-3-hydroxyaspartate ammonia-lyase	in enzymology an erythro-3-hydroxyaspartate ammonia-lyase ec 4.3.1.20 is an enzyme that catalyzes the chemical reaction
index kentucky	index is an unincorporated community in morgan county kentucky united states its post office 2 is closed.
list of members of the house of representatives of the netherlands 2010–12	the list of members of the house of representatives 2010-2012 is the list of members of the house of representatives the lower house of the states-general of the netherlands according to the outcome of the dutch general election of 2010 the members of the new house of representatives were installed on june 17 2010 their term ended on september 19 2012 there has been a sizable number of mutations since due to the particular nature of the dutch constitutional system new members are supplied from their party lists so the resignation of individual members seats does not change the balance of power in the states-general.
hd 88522	hd 88522 is a double or multiple star the component stars are two white stars of similar spectral type—a1v and a2v—and luminosity.[2]
cei-rigotti	the cei-rigotti also known as the cei gas rifle[1] is an early automatic rifle created in the final years of the 19th century by amerigo cei-rigotti an officer in the royal italian army.
ranunculus pusillus	ranunculus lindheimeri ranunculus oblongifolius ranunculus tener
sweden at the 1976 summer paralympics	sweden sent a delegation to compete at the 1976 summer paralympics in toronto canada its athletes finished ninth in the overall medal count.[1]
dacian fortress of monariu	it was a dacian fortified town.
linda beatrice brown	linda beatrice brown is an african american author and educator she was born in akron ohio and went to college in north carolina at bennett college while in north carolina she won several awards for her writing in both fiction and nonfiction brown has published many books including belles of liberty black angels crossing over jordan and the long walk the genres and styles of writing in which she wrote include fiction nonfiction playwriting and poetry many of her works are centered on the civil rights movement and the struggles that can be rooted back to slavery during the time of the american civil war.
joe cassidy gaelic footballer)	joe cassidy born 2 april 1977[2] is an irish retired gaelic footballer and currently a manager he played for derry between 1997 and 2001 cassidy played his club football for bellaghy wolfe tones and won the ulster senior club football championship twice and the derry senior football championship 6 times with the club for both club and county cassidy played in forward line.
jászladány	jászladány is a village in jász-nagykun-szolnok county,[1 in the northern great plain region of central hungary.
ormas indiana	ormas is an unincorporated community in whitley and noble counties in the u.s state of indiana.[2]
list of bridges in ankara	this is a list of bridges in the city of ankara turkey.
david reynolds author)	david clifton reynolds born october 1948 is an author and publisher.
george bowers filmmaker)	george bowers april 20 1944 august 18 2012 was an american film director editor and producer.[2]
folch solution	folch solution is a solution containing chloroform and methanol usually in a 2:1 vol/vol ratio.[1 one of its uses is in separating polar from nonpolar compounds for example separating nonpolar lipids from polar proteins and carbohydrates in blood serum.
ali shakouri-rad	ali shakouri-rad persian ل کوری‌راد‎‎ is an iranian physician and reformist politician.[1 he is a member of central council in the islamic iran participation front[2 and islamic association of iranian medical society.[3 since 2015 he holds office as the general secretary of union of islamic iran people party.
arise gheorghe arise ioan!	arise gheorghe arise ioan romanian ridică-te gheorghe ridică-te ioane! is a poem by radu gyr in 1958 radu gyr was imprisoned and sentenced to death commuted to life sentences and pardoned a few years later by the communist authorities because of his subversive poem the poem had asked for peasants to oppose in every way the regime's agricultural policies it had been issued as the last wave of brutal collectivization was taking hold of the rural landscape while in prison he was not treated for any illnesses he had was often starved and even tortured.[1]
