title	text
st patrick's society of montreal	the st patrick's society of montreal french sociét saint-patrick de montréal is the oldest fraternal organization in canada in existence since march 17 1834,[1 it predates the sociét saint-jean baptiste by three months the st patrick's society continues to be a leader in montreal's irish community organizing such annual events as the st patrick's ball the st patrick's luncheon and the st patrick's society's annual christmas concert the society's current president is scott phelan.
inokashira park	inokashira park 井の頭恩賜公園 inokashira onshi kōen straddles musashino and mitaka in western tokyo japan inokashira pond 井の頭池 and the kanda river water source 神田上水 kanda jōsui) established during the edo period are the primary sources of the kanda river.
honour blood	"honour blood is the fourth album by the british heavy metal band tank released in 1984 by the time of this album algy ward was the last original member of the group remaining as the brabbs brothers had been replaced by cliff evans on guitar and graeme crallan on drums reuniting crallan with his former bandmate in white spirit mick tucker) the album follows much the same format as the band's previous album this means war with seven songs several quite lengthy of melodic heavy metal primarily about the topic of war however the band explores some different subject matter on side two as w.m.l.a. and too tired to wait for love"" express frustration in love while chain of fools is a cover of the 1967 hit by aretha franklin.[3]"
2017 pac-12 conference men's basketball tournament	the 2017 pac-12 conference men's basketball tournament presented by new york life was the postseason men's basketball tournament for the pac-12 conference and was played during march 8–11 2017 at t-mobile arena in paradise nevada the champion arizona received the pac-12 conference automatic bid to the 2017 ncaa tournament with a 83-80 win over oregon in the finals.
darryl sutton	darryl sutton 27 july 1952 28 january 2017)[1 was an australian rules footballer who played for north melbourne richmond and sydney in the victorian football league vfl).
queensland highlanders pipe band	the queensland highlanders pipe band is a grade one pipe band based in brisbane queensland australia.
peter monroe hagan	peter monroe hagan 1871–1930 was sheriff of putnam county florida in 1916–1924 and 1928–1930 he is known for opposing the ku klux klan and mob violence in the county in the violent period between 1915 and 1930.[1 his thwarting of lynching attempts and his winning the pivotal 1928 election became a referendum against klan and mob violence.
hovin telemark	hovin is a former municipality in telemark county norway.
battle of vitebsk 1812)	the battle of vitebsk sometimes spelled witepsk was a military engagement that took place on 26 and 27 july 1812 during the french invasion of russia the battle put a french force under the command of emperor napoleon i in combat with russian rearguard forces under general petr konovnitsyn on 26 july and peter von der pahlen on 27 july and ended with the russian forces making a strategic retreat from the battlefield.
brian lenihan footballer)	brian lenihan born 8 june 1994 is an irish professional footballer who plays as a right back or midfielder for premier league club hull city.
tert-amyl methyl ether	tert-amyl methyl ether tame is an ether used as a fuel oxygenate it has an ethereous odor.[1 unlike most ethers it does not form peroxides on storage.
motorbike practical test	the uk practical motorcycle tests consist of a practical test of two modules to first ride on the road a candidate must complete compulsory basic training,[1 however there is no test.
recurvebill	syndactyla striatus syndactyla ucayalae
kingcol	kingcol was a british army flying column created during the anglo-iraqi war.
think before you speak	think before you speak is the debut album by english indie rock band good shoes which was released on 26 march 2007 on brille records the album was recorded in nineteen days in malm in sweden by per sunding at tambourine studios.
joe hirst	joe hirst born 21 april 1987 in wakefield is a rugby league footballer playing at club level for halifax wakefield trinity reserve grade) featherstone rovers and sheffield eagles as a second-row or loose forward/lock joe signed for sheffield eagles in 2009 and in 2011 won the supporters player of the year award along with the players player of the award as sheffield reached the championship grand final.
mc lon	"mc lon,[1 stage name of airon de lima is a singer-songwriter he came to fame after the release of the song novinha vem que tem"" that has over 30 million hits on youtube and is now one of the leading names in funk ostentação.[2][3]"
dino and carlo's bar	dino and carlo's was a small bar in san francisco on vallejo ave on the opposite side of columbus ave from north beach from 1965 until 1968 which showcased new musical groups poets and artists dino and carlo's is exceptional in that it showcased so many later to be famous music groups and other personages while forgotten by many of its patrons it is remembered by those given the opportunity to perform there.
sunrise play)	sunrise 日 richu is a 1936 chinese-language play by cao yu.[1][2]
first calgary petroleums	first calgary petroleums ltd was a calgary alberta based oil and gas company engaged in the exploration for and development and production of petroleum and natural gas in north africa and the middle east it had no domestic holdings in september 2005 the company announced that it had a plan in place to move towards production wells in algeria driving the share price upwards.
mohegan indians v connecticut	"mohegan indians v connecticut 1705–1773 was the first indigenous land rights litigation in history in a common law jurisdiction.[1 james youngblood henderson professor of law calls the case the first major legal test of indigenous tenure.""[2 robert clinton calls it the first formal litigation of north american indian rights.""[3]"
hiiu	hiiu is a subdistrict estonian asum in the district of nõmme tallinn the capital of estonia it covers an area of 2.50 km2 0.97 sq mi)[2 and has a population of 3,986 as of 1 january 2015[update]),[1 population density is 1,556/km2 4,031/sq mi).
national union of leather workers and allied trades	the national union of leather workers and allied trades was a trade union in the united kingdom representing workers who made items out of leather.
cañada de calatrava	cañada de calatrava is a municipality in ciudad real castile-la mancha spain it has a population of 80.
list of sony pictures television series	
psilocybe araucariicola	psilocybe araucariicola is a species of psilocybin mushroom found in brazil where it grows on decayed araucaria angustifolia wood in the floresta nacional de são francisco de paula in rio grande do sul.[1]
6th summit of the americas	"the sixth summit of the americas spanish vi cumbre de las américas was held at cartagena colombia on april 14–15 2012.[1][2 the central theme of the summit was connecting the americas partners for prosperity.""[3 the main issues at the summit's agenda was the exclusion of cuba the legalisation of drugs to fight the war on drugs and argentina's sovereignty claims over the falkland islands additionally criticism of an expansionist monetary policy was also leveled on the developed economies a final statement was not forthcoming over the issue of cuba's inclusion in the next summit which was supported by all states except the united states and canada who refuse the southern support however the 7th summit of the americas was chosen to be held in panama.[4]"
basil willey	basil willey july 25 1897 september 3 1978 was a professor of english literature at cambridge and author of well-written and scholarly works on english literature and intellectual history.
samuel p cox	samuel p cox december 16 1828 august 21 1913 was a businessman and farmer who is best remembered as the commander of the union troops that killed bloody bill anderson in the battle of albany in the american civil war.
charles frédéric girard	charles frédéric girard 8 march 1822 29 january 1895 was a french biologist specializing in ichthyology and herpetology.
really good friends	the so-called really good friends rgf club is a sub-group of members of the world trade organization formed in 2012 to discuss the possibility of a services liberalization agreement.[1 most members of the really good friends group are top global economies which account for the bulk of world trade with the eu and the us representing 40%.[2 the participating countries started crafting the proposed trade in services agreement in february 2012.
2015 siu edwardsville cougars softball team	the 2015 siu edwardsville cougars softball team represented southern illinois university edwardsville siue during the 2015 ncaa division i softball season the cougars led by twenty-seventh year head coach sandy montgomery played their home games at cougar field on the siue campus as a member of the ohio valley conference ovc).[2]
l n hardas	hardas laxmanrao nagrale marathi रदा क्ष्मणरा गराळे) 1904–1939) popularly known as babu l.n hardas marathi ाब ल न रदास was a dalit leader and social reformer in india he was an ardent follower of dr bhimrao ramji ambedkar and was pioneer of the practice of exchanging the greeting jai bhim amongst the dalits he was also a prominent labour leader in the central province and was the general secretary of the independent labour party in the province.[1]
uwe bohm	uwe bohm born 23 january 1962 is a german actor he has appeared in over 70 films and television shows since 1976 he starred in the 1990 film herzlich willkommen which was entered into the 40th berlin international film festival.[1]
denasalization	in phonetics denasalization is the loss of nasal airflow in a nasal sound such as a nasal consonant or a nasal vowel that may be due to speech pathology but also occurs when the sinuses are blocked from a common cold in which case it is called a nasal voice' the latter is not a linguistic term. the symbol in the extended ipa is ◌͊⟩.
international hiv/aids alliance	the international hiv/aids alliance ihaa is a global partnership of nationally based governmental and non-governmental organizations which support community organizations which promote hiv/aids issues in developing countries.[1 the alliance was created in november 1993 as the international alliance supporting community action on aids and later renamed the international hiv/aids alliance.
bertrancourt	1 french land register data which excludes lakes ponds glaciers 1 km 0.386 sq mi or 247 acres and river estuaries.
richard aldrich artist)	richard aldrich born 1975 in hampton virginia is a brooklyn-based painter who exhibited in the 2010 whitney biennial.[1]
irton with santon	irton with santon is a civil parish in copeland cumbria england which includes the village of santon bridge it has a parish council.[1 in the 2011 census it was recorded as having a population of 316.[2]
dundurn scotland	dundurn is the site of a pictish hillfort in what is now strathearn in scotland.
angry all the time	"""angry all the time is a song written by bruce robison and first recorded on his 1998 album wrapped it was later covered by tim mcgraw with guest vocalist faith hill released in july 2001 mcgraw's version was the second single from mcgraw's set this circus down album the song reached number one on the billboard hot country singles tracks now hot country songs charts."
lalo language	lalo chinese 罗 western yi is a loloish language cluster spoken in western yunnan china by 300,000 speakers speakers are officially part of the yi nationality and chinese linguists refer to it as western yi due to its distribution in western yunnan lalo speakers are mostly located in southern dali prefecture especially weishan county considered the traditional homeland of the lalo.[3 historically this area is the home of the meng clan who ruled the nanzhao kingdom 737–902 ce) many core lalo claim to be descendants of the meng clan.
william r cosentini	william randolph cosentini june 12 1911 january 28 1954 was an american mechanical engineer and entrepreneur who founded cosentini associates.
the mouse problem	"""the mouse problem is a monty python sketch first aired in 1969 as part of sex and violence the second episode of the first season of monty python's flying circus."
henri simon marxist)	henri simon born in 1922 is a marxist militant and advocate of council communism he participated in socialisme ou barbarie and informations et correspondances ouvrières,[1 and since 1975 has been involved in changes et mouvement.
cotton futures act of 1916	the cotton futures act of 1916 required the principal meaning the exact type and grade of cotton be given to the government upon sale at a cotton exchange so that the usda could keep track of what was being grown and where it replaced the cotton futures act of 1914 which was ruled unconstitutional.
1989–90 cuban national series	henequeneros won the first of two straight cuban national series titles in 1990 defeating santiago de cuba four games to two industriales took third place after defeating granma for the first time a playoff final between two teams were played the playoff series consisted of round-robin-games the previous years.
1998 philadelphia wings season	the 1998 philadelphia wings season marked the team's twelfth season of operation.
tal smith	talbot merton smith born september 27 1933 is an american former professional baseball executive who has served in high baseball operations positions—including general manager and club president—as well as the founder of a firm that advises major league baseball teams on salary arbitration cases.
yuriko chiba	yuriko chiba 千 利子 chiba yuriko is an animator and character designer.[1 some of her major character designs were for anime shows to heart figure 17 planetes and sacred seven in animation direction she worked on i dream of mimi berserk to heart and steel angel kurumi zero.
william h hicks	william h hicks born august 27 1925 is an american former politician he served in the new jersey general assembly for the 35th district as a democrat he was born in littleton north carolina and resides in paterson new jersey.[1][2]
josephine johnson genzabuke	josephine johnson genzabuke is a member of parliament in the national assembly of tanzania.
jason quenneville	jason quenneville born february 23 1982) professionally known as daheala /da-he-la) is a record producer and songwriter from canada.[1 he has produced significantly for artists such as the weeknd belly massari among others.[2 he collaborates and co-produce with max martin daft punk rick rubin metro boomin ben billions dannyboystyles illangelo and doc mckinney.
doug kershaw	douglas james doug kershaw born january 24 1936[1][2] is an american fiddle player singer and songwriter from louisiana active since 1948 kershaw has recorded fifteen albums and charted on the hot country songs charts.
list of rivers of romania alphabetic)	
st boniface's church bunbury	st boniface's church stands prominently in the village of bunbury cheshire england it is recorded in the national heritage list for england as a designated grade i listed building.[1 the church dates mainly from the 14th century its features include the ridley chapel the alabaster chest tomb of sir hugh calveley and the tomb of sir george beeston richards considers it is architecturally one of the most important examples of its period in cheshire.[2 alec clifton-taylor includes it in his list of best english parish churches.[3 it is an active anglican parish church in the diocese of chester the archdeaconry of chester and the deanery of malpas its benefice is combined with that of st jude tilstone fearnall.[4]
carson county texas	carson county is a county located in the u.s state of texas as of the 2010 census its population was 6,182.[1 the county seat is panhandle.[2 the county was founded in 1876 and later organized in 1888.[3 it is named for samuel price carson the first secretary of state of the republic of texas.[4]
banco nacional de crédito	banco nacional de crédito bvc bnc) commonly abbreviated as bnc is a venezuelan commercial bank headquartered in caracas it was founded in 1977 in san antonio del táchira as banco tequendama branch of the banco tequendama colombia.
arthur i appleton	arthur ivar appleton october 14 1915 january 15 2008 aged 92 was a businessman from florida who was one of the leading thoroughbred horse breeders and owners in the united states he made his fortune in the electrical supply business in chicago.
ouricuri	ouricuri is a city in the state of pernambuco brazil it is located in the mesoregion of sertão pernambucano ouricuri has a total area of 2,423 square kilometers and had an estimated population of 66,978 inhabitants 1 in 2009 according to the ibge.
heinkel he 8	the heinkel he 8 was a reconnaissance floatplane built in germany in the late 1920s it was developed at the request of the danish navy which had noted the success of the he 5 in swedish service and wished to purchase a similar aircraft as well as licensed production as the orlogsvaerftet hm.ii apart from its new armstrong siddeley engine the he 8 also differed from the he 5 and previous members of the he 1 family in having a conventional empennage 22 aircraft were operated until the german invasion in 1940 after which one example was impressed into luftwaffe service and the remainder placed in storage.
andrés makin	andrés makin jr born 11 april 1992 is a belizean professional footballer who currently plays for police united and the belize national football team as a midfielder.
coreopsis pulchra	coreopsis pulchra is a north american wildflower of the southeastern united states in the sunflower family its common names are woodland tickseed showy tickseed and beautiful tickseed.
eastenders spin-offs	eastenders is a long-running british soap opera that has aired on bbc one since 19 february 1985 since its inception several spin-offs have been produced including books television documentaries videos music singles and an album during the run up to the first episode of eastenders interest with the public was already high something which continued afterwards eastenders proved as successful as was hoped for by the bbc in its first years so they capitalised on it with a number of products.
2001–02 tunisian ligue professionnelle 1	the 2001–02 tunisian ligue professionnelle 1 season was the 76th season of top-tier football in tunisia.
shooting of joseph mann	on july 11 2016 randy lozoya and john tennis two sacramento police officers attempted to run over and later shot and killed joseph mann a 51-year-old mentally ill and homeless african-american man.[1][2][3][4][5][6]
the oscar film)	the oscar is a 1966 american drama film written by harlan ellison clarence greene russell rouse and richard sale directed by rouse and starring stephen boyd singer tony bennett in his film debut) comedian milton berle in a dramatic role) elke sommer ernest borgnine jill st john eleanor parker joseph cotten edie adams peter lawford broderick crawford ed begley walter brennan and jack soo also appearing are bob hope hedda hopper merle oberon frank sinatra and nancy sinatra as themselves.
spargapeithes	spargapeithes[1 was the name of a king of the scythian[2 tribe of the agathyrsi.
st john the baptist church winchester	coordinates 51°03′44″n 1°18′23″w 51.062285°n 1.306399°w 51.062285 1.306399
list of rulers of bosha	the following is a list of rulers of the kingdom of garo or bosha bosha was one of the kingdoms on the periphery of the gibe region of ethiopia it existed from 1567 to 1883.
ian roderick macneil	ian roderick macneil of barra the macneil of barra chief of clan macneil also known as clan niall and 26th of barra also baron of barra)[1 was a scottish american legal scholar he was born 20 june 1929 and died 16 february 2010.
brand peak	brand peak is a sharp snow-covered peak located 10 nautical miles 19 km east-southeast of the eternity range and 4 nautical miles 7 km northwest of mount duemler in palmer land it was mapped by the united states geological survey in 1974 and named by the advisory committee on antarctic names for timothy brand a united states antarctic research program biologist at palmer station in 1974.[1]
sagran	sagran persian گران‎‎ also romanized as sagrān and sakrān)[1 is a village in miyan taleqan rural district in the central district of taleqan county alborz province iran at the 2006 census its population was 236 in 61 families.[2]
mary swanzy	mary swanzy hrha 15 february 1882 7 july 1978 was an irish landscape and genre artist.[1 noted for her eclectic style she painted in many styles including cubism fauvism and orphism,[2 and was one of ireland's first abstract painters.[3]
interivoire	interivoire formally known as societ ivoirienne de transport aerien was an airline of the ivory coast it was founded in 1978 and ceased operations in 1979.[1]
pristosia	pristosia is a genus of beetles in the family carabidae containing the following species:[1]
herbert henley	herbert sydney henley 27 october 1889 4 october 1966 was an australian politician.
philippe durel	philippe durel born 13 august 1954 is a former french racing cyclist he rode in the 1978 and 1980 tour de france.[1]
deudorix kayonza	deudorix kayonza the false coffee playboy is a butterfly in the lycaenidae family it is found in sierra leone ivory coast ghana cameroon the republic of the congo the central african republic the eastern part of the democratic republic of the congo western uganda and zambia.[2 the habitat consists of forests.
adebisi	"adebisi is both a surname and a given name of yoruba origin meaning we added to the crown"".[1 notable people with the name include:"
sima yuanxian	sima yuanxian 司馬元顯 382–402) formally heir apparent zhong of kuaiji 會稽忠世子) was briefly a regent of jin dynasty 265-420) during the reign of his developmentally-disabled cousin emperor an.
water by the spoonful	water by the spoonful is a play by quiara alegría hudes it won the 2012 pulitzer prize for drama.[1 hudes had previously won the 2008 tony award for best musical for in the heights.[2]
palmer township sherburne county minnesota	palmer township is a township in sherburne county minnesota united states the population was 2,414 at the 2000 census.
pietro fontana engraver)	pietro fontana 1762 18 september 1837 was an italian engraver.
tibor kozma	tibor kozma 1909 24 march 1976 was an american conductor pianist accompanist and vocal coach of hungarian birth he began his career as an opera conductor in europe and ecuador before emigrating to the united states in 1941 ultimately becoming a united states citizen in 1945.[1 he worked as a conductor accompanist and vocal coach in new york city during the 1940s and 1950s notably serving on the conducting staff of the metropolitan opera from 1950-1957 he then had a successful teaching career at the jacobs school of music at indiana university from 1957 until his death 19 years later.
2015 lima challenger	the 2015 lima challenger was a professional tennis tournament played on clay courts it was the ninth edition of the tournament which was part of the 2015 atp challenger tour it took place in lima peru between october 26 and november 1 2015.
ise bige	ise bige was the king of cayor in part of modern senegal twice during the 18th century he served as king from 1748–1749 and again from 1758-1759.
queen of the new year	queen of the new year is the fifth and final single from the album when the world knows your name by the scottish rock band deacon blue.
rho meson	in particle physics a rho meson is a short-lived hadronic particle that is an isospin triplet whose three states are denoted as + 0 and − along with pions and omega mesons the rho meson carries the nuclear force within the atomic nucleus after the pions and kaons the rho mesons are the lightest strongly interacting particle with a mass of roughly 6990123367589499000♠770 mev for all three states there should be a small mass difference between the and the 0 that can be attributed to the electromagnetic self-energy of the particle as well as a small effect due to isospin breaking arising from the light quark masses however the current experimental limit is that this mass difference is less than 6987112152354090000♠0.7 mev.
2013 tour of belgium	the 2013 tour of belgium was the 83rd edition of the tour of belgium cycling stage race it took place from 22 may to 26 may 2013 in belgium the race was a part of the uci europe tour.
cimolopterygidae	cimolopterygidae is a group of extinct birds known from the late cretaceous period remains attributed to cimolopterygids have been found in the frenchman formation of saskatchewan the lance formation of wyoming the fox hills formation of colorado the hell creek formation of montana and the allen formation of rio negro argentina most date to the end of the maastrichtian age about 66 million years ago though a much earlier species has also been identified from the campanian-aged dinosaur park formation of alberta about 75 million years ago.[2][1]
matti hiukka	matti hiukka born 5 may 1975[1] is a finnish football manager and a former footballer.
david de sola pool	david de sola pool hebrew ו ול ול‎ 1885–1970 was the leading 20th-century sephardic rabbi in the united states a scholar author and civic leader he was a world leader of judaism.[4]
